text,sentiment,eof,responsiveness,accuracy
"শফিউল ভাই আমি পশ্চিমবঙ্গ থেকে বলছি, ভাই এই ডিভাইস খুব ভালো, কিন্তু এই ডিভাইসের মতো যদি রাতে মাছ চুরি বন্ধ করার জন্য এরকম একটি ডিভাইস বানান তাহলে অনেক মাছ চাষী উপকৃত হবে, দয়া করে ভাই এটা নিয়ে একটু ভাবুন", positive, high, na, high
এগিয়ে যাও, positive, na, na, na
"আমাদের জৈব (কেঁচো সার) খামার থেকে কেঁচো ও সার বিক্রয় করা হয়, যদি কোন ব্যক্তি বা খামারির বা ব্যবসায়িক প্রয়োজন হয় তাহলে যোগাযোগ করুন এই নম্বরে: ০১৭৫৭-৯৬৮৩০৫", neutral, na, na, na
"বাহ, আমি মুগ্ধ", positive, na, na, na
জনাব শফিউল আলম ও তানিয়া চৌধুরী দম্পতিকে অভিনন্দন যারা এত সুন্দর একটা আবিষ্কার সম্পন্ন করে বাণিজ্যিক পর্যায়টাকেও গুছিয়ে নিয়ে স্বপ্নের পূর্ণ বাস্তবায়ন করতে চলেছেন, positive, na, na, high
সে জন্য আরও একটা ধন্যবাদ, positive, na, na, na
পরিপূর্ণ বিজ্ঞানী বলতে যা বোঝায়, positive, na, na, na
আপনারা বাংলাদেশ সরকারকেও এটা সতর্ক করে দিলেন যে কোনো একটা আবিষ্কার এবং সেটার প্রয়োগের জন্য আমরা ঐভাবে প্রস্তুত নই, negative, low, slow, low
আমাদের সন্তানদের মেধার পরিপূর্ণ প্রয়োগের জন্য রাষ্ট্র তাদের পূর্ণ পৃষ্ঠপোষকতা করতে পারছে না, negative, low, slow, low
হলে হয়তো ভিন্ন দেশ আমাদের সম্পদের ভাগীদার হতো না, negative, na, na, na
"ধন্যবাদ দিয়ে ছোট করবো না জনাব শায়খ সিরাজকে, যার উদ্যোগ পুরো বাংলাদেশকে অর্থনৈতিক স্বনির্ভরতা দিয়ে বদলে দিয়েছে, যার পুরস্কার তিনি পরকালেও পাবেন নিশ্চয়ই", positive, na, na, high
অভিনন্দন আপনাদের দুজনকেই, positive, na, na, na
"শফিউল ভাইকে অনেক শুভেচ্ছা, সিরাজ স্যারকেও ধন্যবাদ আপনার চ্যানেলে এটি প্রকাশ করার জন্য", positive, na, na, na
এটা সৌর সিস্টেম করলে আরও ভালো হতো, positive, high, na, na
"হ্যালো সফটওয়্যার ইঞ্জিনিয়ার শফিউর রহমান, আপনি সত্যিই মহান ভাই", positive, na, na, na
"আমি আপনাকে ভারতে স্বাগত জানাই, আমি আমার ইমেইল ঠিকানা দিচ্ছি, দয়া করে আমাকে মেইল পাঠান anjumanara018@gmail.com", neutral, na, na, na
ফোন নম্বর দিন, neutral, na, na, na
"কোন লাভ হবে না, শুধু শুধু সময় আর টাকা নষ্ট", negative, low, slow, low
স্বাগতম, positive, na, na, na
"শফিউল ভাইকে ধন্যবাদ, সত্যিই দারুণ কাজ", positive, na, na, high
আশা করি আমাদের সরকার সেই প্রযুক্তি ব্যবহার করবে এবং কৃষকরা সেই প্রযুক্তি থেকে উপকৃত হবে, positive, high, na, na
মাশাআল্লাহ, positive, na, na, na
"ভাই বডিতে সোলার প্যানেল দিলে ভালো হয়, মানে নিজে চার্জ হওয়ার প্রযুক্তিটা দিলে ভালো হয়", positive, high, na, na
দাম?, neutral, na, na, na
স্বাগতম শফিউল্লাহ ভাই, positive, na, na, na
এই আবিষ্কারে বাংলাদেশের মৎস্য খামার অনেক এগিয়ে যাবে ইনশাআল্লাহ, positive, na, na, high
কাজের বিকল্প নেই, positive, na, na, na
"ইচ্ছা মানুষকে কোথায় নিয়ে যায়, তা কাজ করে জানতে হয়", positive, na, na, na
কাক্কু আমি একটা কৃষি চ্যানেল খুলেছি, neutral, na, na, na
চমৎকার, positive, na, na, na
ভালো কাজ ভাই, positive, na, na, na
"এত বুদ্ধি আমাদের বাংলাদেশে, তাও আমরা পিছিয়ে, বলার ভাষা নাই", negative, na, na, low
সুন্দর, positive, na, na, na
"ধারণাটা খুবই সাধারণ, কার্যকারিতা কেমন সেটাই আসল ব্যাপার", neutral, na, na, moderate
"আসসালামু আলাইকুম, ধন্যবাদ জানাই, আন্তরিক ধন্যবাদ জানাই", positive, na, na, na
কোরিয়ার জ্ঞান বাংলাদেশে বলে কোনো লাভ নেই কারণ এদেশের কৃষি অফিসগুলো বেশিরভাগই চোর, negative, low, slow, low
"তার প্রমাণ জনাব শফিউল, তিনি এইসব চোর-ছ্যাঁচোড়ের জ্বালায় বাংলাদেশ ছেড়ে কোরিয়াকে তার পেটেন্ট দিয়েছেন", negative, na, na, na
"তারা কৃষি বিভাগ, আমার মনে হয় কৃষি বিষয়ে আপনার চেয়ে বেশি জানে না (অজ্ঞ)", negative, na, na, low
"কৃষি বিষয়ক কোনো কর্মসূচি এখন পর্যন্ত এই চোর বিভাগ জনগণকে দেখাতে পারেনি, লজ্জা", negative, low, slow, low
আমার একটা লাগবে ভাই, neutral, na, na, na
আমার একটা লাগবে, neutral, na, na, na
উনার সাথে কয়েকমাস আগে ট্রেনে দেখা হয়েছিল, neutral, na, na, na
মাশাআল্লাহ আমি কোরিয়াতেই আছি, neutral, na, na, na
"সাবাস আমাদের বাংলাদেশের গর্ব শফিউল আলম ভাই, অনেক অনেক ধন্যবাদ আপনাকে", positive, na, na, na
"আমি বাংলাদেশ থেকে দেখছি আজ-জানুয়ারি ০৬-০১-২০১৯ রবিবার, সময় সকাল ৭:৪৮", neutral, na, na, na
ধন্যবাদ প্রকৌশলী শফিউল আলমকে, positive, na, na, na
তার উচিৎ হবে মডেলিং সফটওয়্যার তৈরী করা, neutral, moderate, na, na
দক্ষিণ কোরিয়ার নিজের বড় উদ্ভাবক, neutral, na, na, na
"শফিউল আলমকে ধন্যবাদ, মডেলিং সফটওয়্যার তৈরি", positive, na, na, na
চমৎকার, positive, na, na, na
মাশাআল্লাহ, positive, na, na, na
"এই রকম একটা প্রজেক্ট আমার মাথায় অনেক দিন যাবত ঘুরপাক খাচ্ছে, জানি না কখন বাস্তব রূপ দিতে পারব", neutral, na, na, na
"স্যার, এটা অসম্ভব", negative, na, na, low
"তিনি শুধু এরারেটর, ফিডিং মেশিন এবং একটি কম্পিউটার প্রযুক্তিকে একত্রিত করতে চেয়েছিলেন, যা জার্মানি, চীন এবং অন্যান্য অনেক দেশে ব্যবহৃত হচ্ছে", neutral, moderate, na, moderate
বাংলাদেশে এই ধরনের প্রকল্প দেখতে চাইলে হোসাইন মডার্ন ফিশিং টেক লিমিটেড দেখুন, neutral, na, na, na
"কোরিয়া যাওয়ার সময় পাসপোর্টে ফার্স্ট নেম, লাস্ট নেম গোঁজামিল হয়ে গেছে আলাম এমডি সাইফুল", negative, low, slow, low
"শুভ সংবাদ বাংলাদেশের জন্য, স্যালুট", positive, na, na, na
স্যার বায়োফ্লক মাছ চাষের ব্যাপারে কিছু বলবেন কি, neutral, na, na, na
স্যার আমি আপনার ভিডিওকে অনেক অনেক অনেক অনেক ভালোবাসি, positive, na, na, na
মাশাআল্লাহ অভাবনীয় বৈপ্লবিক প্রযুক্তি এগিয়ে চলা বাংলাদেশ, positive, na, na, na
আমাদের চাঁদপুর হাইমচর উপজেলার প্রাণিসম্পদ অফিসের কর্মকর্তার কাছ থেকে কোনো ধরনের সহযোগিতা পাইনা আমরা তাহলে কিভাবে খামার করব, negative, low, slow, na
অভিনন্দন জনাব শফিউল আলম ও মিসেস তানিয়া তাদের খুব দরকারী উদ্ভাবনের জন্য, positive, high, na, high
ধন্যবাদ জনাব শেখ সিরাজ এটি আমাদের চোখে তুলে ধরার জন্য, positive, na, na, na
ধন্যবাদ শেখ সিরাজ স্যার, positive, na, na, na
অভিনন্দন শফিউল আলম তোমার স্মার্ট ডিভাইসের জন্য, positive, high, na, na
আসসালামুআলাইকুম, neutral, na, na, na
খুবই ভালো লাগলো প্রতিবেদনটা দেখে, positive, na, na, na
"স্যার আমি কোরিয়া যেতে চাই, কিন্তু কিভাবে যাব", neutral, na, na, na
দয়া করে জানাবেন, neutral, na, na, na
আমাদের চাষি ভাইরা আল্লাহর উপর নির্ভর করে চাষবাস করবেন না বিজ্ঞানের উপর নির্ভর করুন, negative, na, na, na
তবে বিষাক্ত কিছু ব্যবহার করবেন না, negative, na, na, na
এই দেশে চোর ডাকাত, negative, na, na, na
ধন্যবাদ শফিউল সাহেবকে এতে মাছ চাষিরা উপকৃত হবে, positive, high, na, na
সুন্দর, positive, na, na, na
দুর্ভাগ্য হলেও সত্য এই যে কোনো সরকারের আমলেই গবেষক বা বিজ্ঞানীদের জন্য আলাদা বরাদ্দ বা সুযোগ সুবিধা দেয় না, negative, na, na, na
সুন্দর, positive, na, na, na
বাংলাদেশি কোন কৃষকের কাছে ওয়াইফাই আছে, neutral, na, na, na
আপনি এসে দেখলে আমার ভালো লাগবে, neutral, na, na, na
"আমি এই ডিভাইসের জন্য খুব আগ্রহী, আগ্রহ নিয়ে অপেক্ষা করছি", positive, na, na, na
আমাকে জানাবেন কখন এটি পাওয়া যাবে, neutral, na, na, na
ভালো, positive, na, na, na
শুভকামনা রইল শফিউল স্যারের জন্য, positive, na, na, na
আমাদের দেশের কৃষি কর্মকর্তারা হচ্ছে একেকটা চোর, negative, na, na, na
"এই ছোট দেশের একটা প্রবাদ ছিল মাছে ভাতে বাঙালি, কিন্তু এখন সেই প্রবাদটা আর চলছে না", negative, na, na, na
"এখন প্রবাদটা হচ্ছে চোরে ভাতে বাঙালি, মাছের স্থানে চোর বসে গিয়েছে", negative, na, na, na
"ধন্যবাদ স্যার, কিন্তু আমার একটা সন্দেহ আছে", negative, na, na, na
"আমরা জানি মাছকে খাবার দেওয়ার সময় তারা খাবারের উৎসের দিকে ছুটে আসে, আর এটাতে যেই পাখা ব্যবহার করা হয়েছে, এই পাখাতে কি মাছ আঘাত পেতে পারে না", negative, na, na, na
আমার মনে হয় আরও পরিবর্তন করা দরকার, negative, na, na, na
"অসাধারণ নতুন কিছু শিখলাম এগিয়ে যাও বাংলাদেশ, ধন্যবাদ স্যার", positive, na, na, na
অসাধারণ আবিষ্কার, positive, na, na, na
আঙ্কেল এই ডিভাইসের দাম কত, neutral, na, na, na
তোর এই সিস্টেমে লাথি মারি, negative, na, na, na
"এইসব জিনিসও পুরস্কার পায়, বাহ", negative, na, na, na
খুবই ভালো লাগলো আমরাও যে পারি, positive, na, na, na
"তবে বলবো যত দ্রুত এটি বাজারে দিতে পারবেন আপনাদের জন্য ভালো, কারণ চীনারা এটি নকল করে ছেড়ে দেবে", negative, fast, na, na
"অসাধারণ উদ্ভাবন, ধন্যবাদ শফিউল স্যারকে, বাংলাদেশকে উপস্থাপনের পাশাপাশি মাছ চাষে বাংলাদেশ অনেক ধাপ এগিয়ে যাবে", positive, na, na, na
পরিশেষে স্যালুট শফিউল আলম স্যারকে, positive, na, na, na
দোয়া করি এগিয়ে যাক বাংলাদেশ, positive, na, na, na
"আমার স্বপ্ন আমিও পারব, ইনশাআল্লাহ", positive, na, na, na
আল্লাহ আপনার এবং আমাদের মঙ্গল করুন, positive, na, na, na
"কোরিয়া বলে এতটা সম্ভব, এই দেশে চোর ডাকাত ছাড়া আর কাউকে মূল্যায়ন করা হয় না", negative, na, na, na
দেখেন ভাই বাংলাদেশে এমন অনেক প্রযুক্তি আসে এবং এগুলো মিডিয়ার মধ্যে সীমাবদ্ধ থাকে, negative, na, na, na
বাস্তবে আমরা পাচ্ছি কিনা এটা বড় কথা, negative, na, na, na
ধন্যবাদ, positive, na, na, na
"মাশাআল্লাহ মাশাআল্লাহ খুব সুন্দর উদ্যোগ, জাযাকাল্লাহু খায়ের সবাইকে", positive, na, na, na
"সালাম ভাই, স্যার আপনাকেও", positive, na, na, na
"আমার একটি ডিভাইস লাগে, কিভাবে পাওয়া যাবে", neutral, na, na, na
জাযাকাল্লাহু খায়েরান ধন্যবাদ শফিউল আলমকে আমরা তো চেতনা নিয়ে পড়ে আছি, positive, na, na, na
এমন একটা দেশে জন্মগ্রহণ করেছি সেই দেশে প্রতিভাবান মানুষের কোন মূল্য নাই, negative, na, na, na
যত সব চোর বাটপার, negative, na, na, na
আমরা হলাম তালহা প্রশিক্ষণ এবং আমরাই এই কাজটি করছি এবং শফিউল স্যার আমাদের প্রধান নির্বাহী কর্মকর্তা, positive, na, na, na
"ভাই অন্তর থেকে সালাম, এগিয়ে যাও ভাই", positive, na, na, na
এটি চমৎকার বিষয়, positive, na, na, na
মাশাআল্লাহ ধন্যবাদ স্যার, positive, na, na, na
খুব ভালো লাগলো, positive, na, na, na
আমরা জিততে পারি, positive, na, na, na
সুন্দর ভিডিও এবং ধন্যবাদ, positive, na, na, na
"অনেক সুন্দর, ধন্যবাদ শেখ সিরাজ স্যার", positive, na, na, na
সফিউল স্যারকে এই ডিভাইসটি আবিষ্কার করার জন্য অভিনন্দন এবং ওনার জন্য শুভকামনা, positive, high, na, high
তার সাথে সিরাজ স্যার এমন একটি প্রতিভা প্রকাশ করার জন্য আন্তরিক ধন্যবাদ, positive, na, na, na
আলহামদুলিল্লাহ মাশাআল্লাহ খুব ভালো লাগলো, positive, na, na, na
ভালো কাজ, positive, na, na, na
ভালো, positive, na, na, na
খুবই বুদ্ধিমান, positive, high, na, high
স্যার এই যন্ত্রটি কি বাংলাদেশে পাওয়া যাবে, neutral, na, na, na
এর দাম কত হবে, neutral, na, na, na
দয়া করে জানাবেন, neutral, na, na, na
বিজ্ঞাপনে লাথি মেরে দিয়েছে এত ভালো ভিডিওটা, negative, na, na, na
"ধন্যবাদ স্যার, এই পদ্ধতি দেখে আমি অভিভূত", positive, na, na, na
জনাব শফিউল আলমকে অভিনন্দন, positive, na, na, na
স্যার আমরা এটি দেশে কবে পাব, neutral, na, na, na
দ্রুত এটি বাংলাদেশে নিয়ে আসতে হবে, positive, fast, na, na
এগুলো দেখিয়ে কোনো লাভ নেই কারণ বাংলাদেশের ভিতর যত কৃষি কর্মকর্তা অফিসার আছে তাদের উপর থেকে নিচে পর্যন্ত চোর জাতীয় চোর, negative, na, na, low
মাননীয় প্রধানমন্ত্রী জননেত্রী শেখ হাসিনা এই কৃষি সম্প্রসারণের জন্য বাংলাদেশের ভিতর কোটি কোটি টাকা ব্যয় করতেছেন কিন্তু আমার সোনার বাংলাদেশ কেন স্বয়ংসম্পূর্ণ হইতেছে না, negative, na, na, low
যেখানে ৫০ হাজার টাকা লাগবে ঐখানে ৫ লক্ষ টাকা অনুদান দিতেছে সরকার, negative, na, na, low
বাংলাদেশের প্রতিটি জেলায় জেলায় অঞ্চলে অঞ্চলে যতো কৃষি কর্মকর্তা আছে সরকারি ভাবে তারা হচ্ছে বড় মাপের চোর, negative, na, na, low
এই প্রযুক্তি তেমন কোনো জটিল প্রক্রিয়া না তবে একটু অবাক হচ্ছি এখনো উন্নত দেশে এমন কোনো প্রযুক্তি না থাকার কথা শুনে, negative, na, na, low
এটা খুবই উপকারী হবে আমাদের গ্রাম বাংলার চাষিদের জন্য, positive, high, na, high
তবে দ্রুত এটা বাজারে ছাড়তে পারলে খুব ভালো হবে, positive, fast, na, na
ইনশাআল্লাহ বাংলাদেশ একদিন বিশ্বের বুকে মাথা তুলে দাঁড়াবে, positive, na, na, na
আমি খুবই আনন্দিত হই এই ভেবে যে শায়েখ সিরাজ সাহেব স্যার আমাদেরই দেশের একজন, positive, na, na, na
বেশি কিছু বলার ভাষা নেই আমার শুধু চমৎকার, positive, na, na, na
এটা কি সৌর শক্তিতে চালানো যাবে, neutral, na, na, na
"ধন্যবাদ স্যার, এই পদ্ধতি দেখে আমি অভিভূত, জনাব শফিউল আলম তাকে অভিনন্দন, স্যার আমরা এটি দেশে কবে পাব, চমৎকার প্রতিবেদন", positive, na, na, na
ভালো কাজ স্যার, positive, na, na, na
অনেক অনেক সুন্দর লাগলো স্যার, positive, na, na, na
সুন্দর, positive, na, na, na
অনেক সুন্দর, positive, na, na, na
অপেক্ষা করছি, neutral, na, na, na
ভালো, positive, na, na, na
অনেক অনেক ধন্যবাদ আমাদের চুয়াডাঙ্গাকে তুলে ধরার জন্য, positive, na, na, na
সুন্দর, positive, na, na, na
এইসব দেখলে মনে অন্যরকম একটা প্রশান্তি আসে, positive, na, na, na
দুর্গম এলাকায় যেখানে নেটওয়ার্ক সমস্যা রয়েছে সেখানে অ্যাপটি কিভাবে ব্যবহার করা যাবে, neutral, low, na, low
ভাই বিনামূল্যে রাসায়নিকবিহীন সবজি চাই, neutral, na, na, na
ধন্যবাদ সিনজেন্টা গ্রুপকে, positive, na, na, na
ধন্যবাদ, positive, na, na, na
ধন্যবাদ, positive, na, na, na
ভাই এই অ্যাপটা কেউ কি লিখে দিবেন আমি চেষ্টা করছি আসে না, negative, low, na, low
কারো জানা থাকলে লিখে পাঠান প্লিজ, neutral, na, na, na
সিনজেন্টা বাংলাদেশ লিমিটেডকে ধন্যবাদ, positive, na, na, na
"কৃষকের জন্য অ্যাপ, সুতরাং নামটি আরো সহজ হওয়া উচিত ছিল", negative, low, na, na
কৃষি, neutral, na, na, na
আমি ভাবছিলাম অনুসন্ধান করে অন্য ফসল যোগ করা যায় পরে দেখলাম অনুসন্ধান করলে আসে না পরে বুঝলাম শুধু ধানের ক্ষেত্রে ব্যবহার হবে, negative, low, na, na
সকল ফসল যোগ করা হোক, neutral, na, na, na
রিপোর্টার ভাই হেদায়েত উল্লাহ স্যারের নাম্বার দেন প্লিজ, neutral, na, na, na
সিনজেন্টা খাদ্য নিরাপত্তা নিশ্চিত করছে, positive, high, na, high
সিনজেন্টা অভিযোগ করার কোনো মাধ্যম আছে, neutral, na, na, na
