text,sentiment,eof,responsiveness,accuracy
কীটনাশকের গায়ে ১০০ লেখা থাকলে ৪০ টাকায় পাওয়া যায়, neutral, na, na, high
"এলপিজির গায়ে মূল্য কেন দেওয়া হয় না, আজও বুঝতে পারি না", negative, na, na, low
সারের বস্তার গায়ে মূল্য লেখাটাও বাধ্যতামূলক করুন, positive, na, na, high
"গায়ে লেখা দামে বেশির ভাগ পণ্য বিক্রি হয় না, বেশি দামে কিনতে হয়, এটা দেখার লোক নেই", negative, na, na, low
ঔষধের প্রত্যেকটি পাতায় মূল্য লেখা থাকলে প্রতারণা থেকে রক্ষা পাওয়া যাবে, positive, na, na, high
ভারতীয় পণ্য বর্জন করুন এবং পুরোপুরি কার্যকর করুন, positive, na, na, high
"দেশের মানুষ কোটি কোটি টাকা চায় না, তারা চায় পেট ভরে দুবার খেতে, খাদ্যের দাম কমে গরীব ও মধ্যবিত্ত মানুষের দিকে তাকিয়ে", positive, na, na, high
সঠিক পদক্ষেপ নেওয়া হয়েছে, positive, na, na, high
"অ-কর্মা মন্ত্রী, কাজ হবে না", negative, na, na, low
"খালি বলে যাচ্ছে, বাজার নিয়ন্ত্রণ হচ্ছে না, গরিব মানুষ বাঁচতে চায়", negative, na, na, low
"এই মেশিন কি ভাবে নেওয়া যাবে, সফিউল ভাইয়ের সাথে যোগাযোগ করার কোনো উপায় আছে কি?", neutral, na, na, na
সাত মাছ চাষের এই ডিভাইসটি কি বাংলাদেশে পাওয়া যাবে, neutral, na, na, na
"এই ডিভাইসটি কি এখনো মার্কেটে আসে নাই, কোথায় পাওয়া যাবে জানালে উপকৃত হবো", neutral, na, na, na
"কবে নাগাদ এই স্মার্ট টেকনোলজি পাব, আপনাকে অনেক ধন্যবাদ", neutral, na, na, na
"এই ডিভাইস এখন কি মার্কেটে আছে, থাকলে কেউ জানান", neutral, na, na, na
"যে ব্যক্তি ধৈর্যশীল ও কর্মশীল, সে কখনো অভাবী থাকে না, আল্লাহ তাকে সফলতা দান করবেন", positive, na, na, high
সুন্দর ভিডিও, positive, na, na, high
বতমানে এ মেশিনের বাজারজাত করার অগ্রগতি কি, neutral, na, na, na
"কুমিল্লা বুড়িচং থেকে সুন্দর ভিডিও, কুমিল্লার আরও ভিডিও চাই", positive, na, na, na
"এই ডিভাইস অনেক ভালো, কিন্তু বেশি কারেন্ট প্রয়োজন এবং বারবার চার্জ দিতে হবে, সোলার সিস্টেম করলে ভালো হয়", neutral, na, na, na
শুভকামনা রইলো, positive, na, na, na
"স্যার, ছোটবেলা থেকে আপনার এ্যাগ্রো ভিডিও ফুটেজ দেখে কৃষি উদ্যোগতা হয়ে উঠার চেষ্টা করি", positive, na, na, high
"বাংলাদেশে এই যন্ত্রটি এলে আমি যেন একটি বা দুটি যন্ত্র ক্রয় করতে পারি, অনুরোধ রাখলাম", positive, na, na, high
"উদ্ভাবক সফিউল আলমের সাফল্য কামনা করছি, অক্সিজেন সরবরাহকারি যন্ত্রটি বাংলাদেশের কৃষকের কাছে অচিরেই পৌঁছাবে", positive, na, na, high
কত দিন পর পেতে পারি?, neutral, na, na, na
"চ্যার, আপনাকে অনেক ভাল লাগে, চ্যার আমরা মিসিংটা কখন পাবো", neutral, na, na, na
"আমি একজন মাছ চাষি, এই প্রডাক্টটি কবে পাব এবং কিভাবে পাব জানালে উপকৃত হব", neutral, na, na, na
"আমরা বাংলাদেশে কিভাবে পেতে পারি জানাবেন, আমার নাম্বার ০১৬৮১১২২০২০", neutral, na, na, na
অসাধারণ আবিষ্কার, positive, na, na, high
"এই সব খেলনা দেখতে ভালো লাগে, মাছ চাষে কাজে লাগে না, তাই দেশে জনপ্রিয় হয়নি", neutral, na, na, na
এই ডিভাইসটি কবে বাংলাদেশে পাওয়া যাবে, neutral, na, na, na
"আমি একজন মাছ চাষি, এই ধরনের প্রযুক্তি ব্যবহার করে মাছ চাষে এগিয়ে যেতে চাই", positive, na, na, high
"সার কৈ, শিং ও মাগুর পাবদা মাছের চাষ পদ্ধতি ভিডিও দিলে ভালো হতো", neutral, na, na, na
অনেক অনেক শুভকামনা, positive, na, na, na
"আমি এরকম একটি যন্ত্র চাই, কোথায় পাবো?", neutral, na, na, na
"আসসালামু আলাইকুম স্যার, আশা করি ভালো আছেন, দোয়া করি", positive, na, na, na
"আমার কাছে লতি রাজ কচুর চারা আছে, মানিকগঞ্জ, সারা বছর চাষ করা যায়, ০১৬২০২৩৯৬২৯", neutral, na, na, high
"সরকারি কর্মকর্তা ও শাসকরা বুদ্ধিমান মানুষদের গুরুত্ব দিচ্ছে না, দেশের উন্নতি হবে না, সৎ বুদ্ধিজীবীদের উৎসাহ দিন", negative, na, na, low
"অনেক প্রতিভাবান মানুষ দেশ ছাড়ছে, দুর্নীতি ও আইনশৃঙ্খলা দুর্বল, কৃষক বেশি ভোগ করছে, সরকার সঠিক বিচার দিচ্ছে না", negative, na, na, low
উদ্ভাবনী প্রযুক্তির জন্য শফিউল আলমকে স্বাগতম, neutral, na, na, na
বর্তমানে কি ডিভাইসের মেশিনটা পাওয়া যাবে, neutral, na, na, na
আবিষ্কার করার জন্য আপনাকে ধন্যবাদ, positive, na, na, na
"দোয়া রইল শফিউল ভাই এর জন্য, শুভকামনা", positive, na, na, na
হ্যাঁ ভালো ধারণা ভাইয়া, positive, na, na, na
বায়োফ্লকে এই প্রযুক্তিটা ব্যবহার করা যেতে পারে, neutral, na, na, na
প্রোটোটাইপটা কি কম টাকায় বানানো গেলে বাকি মিটারগুলো আর কিনতে হবে না, neutral, na, na, na
দাম কত, neutral, na, na, na
খুব ভালো, positive, na, na, na
আসসালামু আলাইকুম স্যার, neutral, na, na, na
স্যার এই মেশিনটা কোথায় কিভাবে পাবো দয়া করে জানাবেন, neutral, na, na, na
এটার দাম কত হবে, neutral, na, na, na
আল্লাহর রহমতে আমি খুব তাড়াতাড়ি মৎস্য চাষ শুরু করতে যাচ্ছি, neutral, na, na, na
তাই এটা আমার খুবই প্রয়োজন, neutral, na, na, na
দয়া করে উত্তর দিন স্যার, neutral, na, na, na
খুব সুন্দর হয়েছে আপনার ডিজাইন, positive, na, na, na
বাংলাদেশী হিসেবে গর্বিত, positive, na, na, na
স্যার আমি এই মেশিনটি কিনবো কিভাবে যদি বলেন আমি উপকৃত হবো, neutral, na, na, na
"আল্লাহু আকবার, আমি সর্ব প্রথম মহান আল্লাহ তায়ালার শুকরিয়া আদায় করি, আলহামদুলিল্লাহ", neutral, na, na, na
"আমার প্রশ্ন হল, এই শায়খ সিরাজ স্যারকে কেন নোবেল পুরষ্কার দেওয়া হয় না", neutral, na, na, na
"তার কারণ হল আমি আমার ক্ষুদ্র মাথায় চিন্তা ভাবনা করে দেখেছি, সেটি হল জনগণের ভালো হবে, সেটি নরওয়ের নোবেল কমিটির লোকজন চায় না", negative, na, na, low
"তারা চায় জনগণ গরিব হোক, যেমন ডঃ ইউনুস দেশের গরিবের টাকা শুষে নিচ্ছে, এটা সাধারণ মানুষ বোঝে না, কিন্তু যারা কিছু লেখাপড়া করেছেন ওনারা হয়তো বা বুঝবেন", negative, na, na, low
"এই ডঃ ইউনুসকে দিয়েছেন নোবেল পুরষ্কার, তাহলে আপনারা বুঝেন যে তারা কি চায়", negative, na, na, low
তারা চায় অন্য অন্য দেশ বা জনগণ গরিব হোক এটাই তারা চায়, negative, na, na, low
"আমি আরও কিছু রেফারেন্স দেই সেটি হল, আরব দেশে শান্তি আছে, যেমন কাতার, সৌদি, কুয়েত, বাহরাইন, ও আরব আমিরাত, এই চার পাঁচ দেশে অন্তত শান্তি আছে", neutral, na, na, na
"এরা কোন মানুষের উপর জুলুম করে না, এখন আমার প্রশ্ন কেন এই আরব দেশে নোবেল পুরষ্কার দেওয়া হয় না", neutral, na, na, na
"কারণ একটাই, জনগণের মঙ্গল হোক তারা চায় না, আমি আশা করি আপনারা এখন বুঝতে পারবেন, ইনশাআল্লাহ", negative, na, na, low
আমরা আপনাকে নিয়ে গর্বিত শফিউল স্যার, positive, na, na, na
"ভাই আপনাকে অনেক ধন্যবাদ কিন্তু কি জানেন আপনি এখন কুরআনের চোখে কাফের হয়ে গেছেন, ইহুদি, নাসারা কাফেরদের বিদ্যা চর্চা করছেন", negative, na, na, na
সিরাজ ভাই আপনি কি দয়া করে আপনার যোগাযোগ নম্বরটি শেয়ার করতে পারেন, neutral, na, na, na
"মাশা আল্লাহ, ধন্যবাদ ভাই", positive, na, na, na
"খুব খুব সুন্দর একটি ভিডিও, ভালো লাগলো এটা জেনে", positive, na, na, na
ভালো থাকবেন, positive, na, na, na
ওপেন গ্যাংনাম স্টাইল, neutral, na, na, na
আমি সেলুন দেই রফিকুল ভাইয়ের প্রতি, neutral, na, na, na
শফিউল আমাদের দেশের সম্পদ, positive, na, na, na
"খলিল মৎস্য হ্যাচারী ও ফিশারী, মোবাইল নং ০১৭২১৯৭৪২৪৫, কৈ, শিং, মাগুর, পাবদা, গুলশা মাছের রেনু ও পোনা উৎপাদনকারী প্রতিষ্ঠান", neutral, na, na, na
স্যার এটার দাম কত পড়বে, neutral, na, na, na
এটা কোথায় পাবো, neutral, na, na, na
এটা কি বাংলাদেশে পাবো স্যার, neutral, na, na, na
"মাশাআল্লাহ, সাবাস, দোয়া রইল, আমিন, জেদ্দা থেকে", positive, na, na, na
আমরা জনাব সিরাজকে অনুরোধ করব এই ডিভাইসটি বাংলাদেশে উপলব্ধ করার জন্য উদ্যোগ নিতে, neutral, na, na, na
স্যার আমার এলাকায় যদি আপনি ভিজিট করতেন তাহলে আমি তার ব্যবস্থা করতাম, neutral, na, na, na
"আমিও আগ্রহী ছিলাম, আমার এলাকা চাঁদপুর ০১৬৭৩৩৪১৩৮৬", neutral, na, na, na
সুন্দর ডিভাইস, positive, na, na, na
আপনি কি সৌর শক্তি যোগ করতে পারেন, neutral, na, na, na
"কৃষি আমার প্রাণ, একা মানুষ ও প্রবাসী বলে কিছু করতে পারি না", neutral, na, na, na
এটার দাম কত স্যার এবং কোথায় পাওয়া যাবে, neutral, na, na, na
বাংলার চোরেরা ওদের মূল্যায়ন দিতে জানে না, negative, na, na, na
আসসালামু আলাইকুম স্যার, neutral, na, na, na
আমি একজন ক্ষুদ্র মাছ চাষি, neutral, na, na, na
এটা কতদিন পর বাজারে আসবে, neutral, na, na, na
আমি এই ডিভাইস একটা কিনতে চাই, neutral, na, na, na
এ জন্য স্যার আপনার সাথে কথা বলার খুব প্রয়োজন, neutral, na, na, na
"আমার সাথে একটু যোগাযোগ করেন স্যার, এটা আমার নম্বর ০১৭৬১৭৮৩৫৫৫", neutral, na, na, na
মেশিনটা কই পাবো, neutral, na, na, na
"খুব ভালো কাজ, ধন্যবাদ ভাই", positive, na, na, na
এগিয়ে যাও, positive, na, na, na
"আরে বাস্টার্ড আপনি ইউরোপের দেশগুলোতে ঘুরেন সরকারি টাকা দিয়ে আর বাংলাদেশের কৃষকরা ধানের দাম পায় না, চালের দাম পায় না, শাকসবজি করেও ওগুলোর দাম পায় না", negative, na, na, na
"বিদেশে গিয়ে চাইনিজদের কৃষি উন্নয়ন আপনি ভিডিও করে দেখান, আপনি একটা বাস্টার্ড", negative, na, na, na
"স্যার আমার দুইটা লাগবে, দামটা বলবেন কি দয়া করে", neutral, na, na, na
এটা কি বাংলাদেশে আছে, neutral, na, na, na
দেশের এমন গর্ব শুনে অনেক ভালো লাগে, positive, na, na, na
বাংলাদেশের সবচেয়ে খারাপ প্রশিক্ষণ কেন্দ্রগুলোর মধ্যে একটি, negative, low, na, low
"তারা শুধু টাকা চায়, তারা কিছুই জানে না", negative, na, na, low
তারা ছাত্রদের নিয়ে ভাবে না, negative, na, na, na
"দয়া করে এখানে ভর্তি হবেন না, এটা আপনার সময় এবং টাকা নষ্ট করবে", negative, low, na, na
খুব সতর্ক থাকুন এবং তাদের থেকে সাবধান থাকুন, negative, na, na, na
এই জিনিসটা কোথায় কিনতে পাওয়া যাবে এবং মূল্য কত, neutral, na, na, na
এই প্রোডাক্টটা কোথায় পাবো, neutral, na, na, na
আমি মাছ চাষ করতে চাই, neutral, na, na, na
স্যালুট স্যার, positive, na, na, na
স্যার এটার দাম কত, neutral, na, na, na
এর দামটা দয়া করে জানাবেন, neutral, na, na, na
"বায়োফ্লক মাছ চাষ নিয়ে আপনি একটা প্রতিবেদন করুন, এর সুবিধা অসুবিধা বলুন, ভারত থেকে আপনাকে জানালাম", neutral, na, na, na
"এটা বাংলাদেশ ও ভারত উভয়ের লাভ হবে, একটু আমার কথাটা রাখবেন", neutral, na, na, na
আমি ও আমার বন্ধুরা আপনার প্রোগ্রাম দেখি, neutral, na, na, na
খুব দরকার আসল বায়োফ্লক মাছ চাষ, neutral, na, na, na
"দাম কত টাকা, আমার একটি চাই স্যার", neutral, na, na, na
সাবাস বাংলাদেশের, positive, na, na, na
স্যার আমাদের আর একজন সোনালী গুণী মানুষ, positive, na, na, na
চমৎকার, positive, na, na, na
আমি আনন্দিত, positive, na, na, na
এটি অবশ্যই এই ব্যবসায় উৎপাদনশীলতা বাড়িয়ে তুলবে, positive, high, na, high
"অক্সিজেন তৈরি করা নয়, বরং পানিতে অক্সিজেন দ্রবীভূত করা", neutral, na, na, high
মৎস্য চাষিদের জন্য সুখবর, positive, na, na, na
আপনাদের পুকুরের উৎপাদন বৃদ্ধি করুন ৩ থেকে ৪ গুণ, neutral, na, na, high
অল্প পরিসরে অধিক ঘনত্বে যেকোন মাছ বা চিংড়ি চাষে বিশ্বব্যাপী ব্যবহৃত এরারেটর মেশিন এখন আপনার হাতের নাগালেই পাওয়া যাচ্ছে, neutral, high, na, na
আপনারা এই মেশিন পুকুরে ব্যবহার করে পানিতে প্রয়োজনীয় অক্সিজেনের সরবরাহ সঠিক রেখে মাছের উৎপাদন অল্প খরচে অধিক পরিমাণে বাড়িয়ে তুলতে পারবেন, neutral, high, na, high
"স্টক সীমিত, মেশিন কিনতে চাইলে বা যে কোন তথ্যের জন্য যোগাযোগ করুন মোবাইল +৮৮ ০১৭১৭ ৪৬৪১৭৪, শুধু মাত্র বাংলাদেশের ভিতরেই ডেলিভারি করা হয়", neutral, na, na, na
"ব্রাভো, তুরস্ক থেকে অভিনন্দন", positive, na, na, na
সুন্দর, positive, na, na, na
স্যার এটা বাংলাদেশে কোথায় পাওয়া যাবে এবং এটার দাম কত একটু বলে দিবেন, neutral, na, na, na
আমি তোমার জন্য দোয়া করি, positive, na, na, na
স্যার মাছ চাষ শুরু করে দিয়েছি, neutral, na, na, na
শুরু করেছি ১৫ বিঘা জমিতে, neutral, na, na, na
আমি কুয়েত প্রবাসী, neutral, na, na, na
ইউটিউবের ভিডিও দেখে আমি মুগ্ধ হয়ে এই মাছ চাষ শুরু করেছি, positive, na, na, na
আমার ছোট ভাই আর আমার বন্ধু মিলে মাছ চাষ শুরু করেছি, neutral, na, na, na
খুব শীঘ্রই ডেইরি ফার্ম শুরু করবো ইনশাআল্লাহ, neutral, na, na, na
দোয়া করবেন স্যার, positive, na, na, na
যখন সফল হতে পারবো তখন আপনাকে আমাদের সফলতার গল্প তুলে ধরবো ইনশাআল্লাহ, positive, na, na, na
আমার বাসার পাশের বাড়ি, neutral, na, na, na
"জনাব শফিক, আমি মোঃ গোলাম আজিম", neutral, na, na, na
আমি ব্র্যাকের একজন জেলা এলাকা ব্যবস্থাপক ছিলাম, neutral, na, na, na
এখন আমি একজন ব্যবসায়ী, neutral, na, na, na
"আমার ব্যবসা হল রপ্তানি, আমদানি ও সরবরাহ", neutral, na, na, na
মৎস্য চাষের জন্য আপনার উদ্ভাবনী স্মার্ট ডিভাইস তৈরির জন্য আপনাকে অভিনন্দন, positive, na, na, high
কোরিয়া থেকে আপনার তৈরি পণ্যের ফর্মুলা নিয়ে বাংলাদেশে ফিরে আসার জন্য আপনাকে স্বাগতম, positive, na, na, na
"আমি মনে করি বাংলাদেশ (সরকারি ও বেসরকারি সংস্থা), কোম্পানি, বিদেশী বিনিয়োগকারী এবং এমনকি সাধারণ মানুষ আপনাকে এই কারখানা স্থাপনের জন্য জমি বা আর্থিক সহায়তা দিয়ে সাহায্য করবে", positive, na, na, na
"চিন্তা করবেন না, খুশি হন", positive, na, na, na
"যদি আপনার কোন আপত্তি না থাকে, আমি আপনার সাথে শারীরিকভাবে, মানসিকভাবে এবং আর্থিকভাবে কাজ করতে চাই", positive, na, na, na
কারণ আমি আন্তরিকভাবে দেখতে চাই আপনার মূল্যবান মেশিনটি প্রথমবারের মতো বাংলাদেশের কৃষকদের মধ্যে এবং তারপর বিশ্বের অন্য যেকোনো দেশে ব্যবহৃত হোক, positive, high, na, na
দয়া করে আমাকে এই প্রকল্পটি প্রয়োগে জড়িত হওয়ার কিছু সুযোগ দিন, neutral, na, moderate, na
আমি আশা করি আপনি আমাকে কখনো প্রত্যাখ্যান করবেন না, positive, na, na, na
ভবিষ্যৎ যোগাযোগের জন্য দয়া করে আমাকে কল করুন বা আপনার যোগাযোগ নম্বর দিন, neutral, na, moderate, na
"আমার ঠিকানাঃ মোঃ গোলাম আজিম, পলেন এক্সপোর্ট ইমপোর্ট ট্রেডার্স, প্লট #৮৭, বিএনএস সেন্টার (৮ম তলা), রুম #৮২৬, সেক্টর #৭, উত্তরা, ঢাকা-১২৩০, মোবাইল #+৮৮০১৭২৪৪৫০৩৮০", neutral, na, na, na
খুব ভালো একটা ভিডিও, positive, na, na, na
