text,sentiment,eof,responsiveness,accuracy
কয় এক জন কে দিয়ে বলবে সতের দিনের মধ্য লাইসেন্স হয়ে যায়, neutral, high, fast, high  
সতের দিনে যদি হয় লাইসেন্স তাহলে ঘুষ কে নিবে আমি নিব আমার এক বছর হয়ে গেছে এখনো লাইসেন্স পাইনি, negative, low, slow, low  
আমার এক বছর চার মাস তাও খবর নাই, negative, low, slow, na  
মাসুদ ভালো হয়ে যাও, positive, na, na, na  
সেই মাসুদ, neutral, na, na, na  
এক বছরের বেশি হয়ে গেলো আজো পেলাম না, negative, low, slow, na  
লার্নার কার্ডের জন্য আবেদন করি তা জমা হয় না কেন কেউ কি বলতে পারেন?, negative, low, slow, na  
সবই এখন থেকে সোজাসাপটা লাইনে আসতে হবে, neutral, moderate, na, high  
আইএমএফ এর কারণে সকল দপ্তর সচ্ছতা ও জবাবদিহিতার আওতায় আসছে, positive, na, na, high  
মাসুদ ভালো হইছে তাহলে, positive, na, na, na  
"সরকারি প্রতিষ্ঠানে অনেক হয়রানি করে, ফি দেওয়ার পরও কর্মকর্তা টাকা চাইছে", negative, low, slow, low  
আমার তিন মাস হতে চলেছে এখনও আমার লাইসেন্স আসার খবর নাই, negative, low, slow, na  
"বাংলাদেশে সম্ভব না, ভুয়া খবর", negative, na, na, low  
মাসুদ এখন খুলনায়, neutral, na, na, na  
দুই বছরের উপরে হয়ে গেছে লাইসেন্স পাচ্ছি না, negative, low, slow, na  
সাত দিনের মাথায় লাইসেন্স পাওয়া স্বপ্নের মত লাগে, positive, high, fast, high  
এক জেলার কাগজ ড্রাইভিং লাইসেন্স সব জেলা থেকে নবায়ন করা উচিত, positive, high, fast, high  
একই দিনে লাইসেন্স দেওয়া উচিত যেমন উন্নত দেশে হয়, neutral, high, fast, high  
কেউ কি চিনেছেন এই মহা পরিচালক ডাকাতকে, negative, na, na, low  
"কাদের কাকু বলতো ভালো হয়ে যা মাসুদ, এখন এই ঘুষখোর মাসুদ খুলনায়", negative, na, na, low  
অনিয়ম দুর্নীতি দেখার সাথে সাথে ভিডিও করে ফেসবুকে ছেড়ে দিন, positive, na, fast, high  
কথা আর কাজে মিল হয় না, negative, na, na, low  
মাসুদ তুমি খারাপ হয়ে যাও, negative, na, na, na  
"আর ভাইবা, মাঠ পরীক্ষা মজা নাকি এগুলো", negative, low, na, na  
"আবার মাসুদ হায়রে মাসুদ, এখনো তুমি এখানে", neutral, na, na, na  
গাড়ি চালানো জানতে হবে না শুধু লাইসেন্স নিলেই হবে, negative, low, fast, low  
"শুধু লিখিত দিলে হবে না, চালাতে পারে কি না তা দেখতে হবে", positive, high, moderate, high  
যদি এই দেশ থেকে চলে যায় তাহলে বাংলাদেশের মানুষ খুশি হবে, negative, na, na, na  
আমার জানা মতে পুরনো মাল না সরালে দুর্নীতি থাকবে, negative, na, na, low  
বিআরটিএর সকল কর্মচারীদের বাদ দিয়ে নতুন কর্মচারী নিয়োগ করা হোক, positive, na, fast, high  
টাকা দিয়ে এদেরকে আইনের আওতায় আনা হোক, positive, na, moderate, high  
গজব পরছে নি, neutral, na, na, na  
ওদেরকে সভাকে দেখতে চোরের মত লাগছে, negative, na, na, low  
আমার একটা লাইসেন্স নবায়ন করতে দিলাম এখনও পাইনি, negative, low, slow, na  
বিআরটিসির চেয়ারম্যানকে জুতার মালা পরানো উচিত, negative, na, na, low  
বিআরটিসি অফিস বন্ধ করে দিলে মানুষের ভোগান্তি কমবে, positive, high, fast, high  
"বিআরটিএর মধ্যে দুর্নীতি ঢুকেছে, টাকা ছাড়া পাশ হয় না", negative, low, fast, low  
অত্যন্ত বিপজ্জনক অফিস বিআরটিএ, negative, na, na, low  
আল্লাহ দয়া করুন, positive, na, na, na  
বিআরটিএতে সব খারাপ মানুষের বসবাস, negative, na, na, low  
আমারও একই অবস্থা, neutral, na, na, na  
"বিআরটিএ নতুন চোর, টাকা না দিলে কাজ হয় না", negative, low, slow, low  
আর কত ভোগান্তি, negative, low, slow, na  
"সাধারণ লোক চুরি করলে দোষ, সরকারি লোক চুরি করলে দোষ হয় না", negative, na, na, low  
এখনো কোনো তথ্য দেখায় না, negative, na, slow, low  
"আমি লাইসেন্স করেছি নয় মাস, বিদেশে থেকেও পাইনি", negative, low, slow, na  
২০২১ থেকে সার্ভার চালু হবে অপেক্ষায় আছি, neutral, na, slow, na  
ভাই আমারও তথ্যভান্ডারে নাই এখন কি করতে হবে, negative, na, na, low  
আমার লাইসেন্সের খবর নেই স্মার্ট বাংলাদেশ, negative, na, slow, low  
কতো বছরের আগের খবর এটা, neutral, na, na, na  
মামলা দায়ের করুন, neutral, na, na, na  
ঘুরায় কেনো, negative, low, slow, na  
আবার টাকা দেবে কেনো এর জন্য দায় করা, negative, na, na, low  
ভাই এই লোক বড় দুর্নীতিবাজ, negative, na, na, low  
"ভাই খুলনা বিআরটিএ অফিস শিরোমনি এইখানে টাকা ছাড়া কোন কাজ করে না জানবেন এইখানে সব দুর্নীতিবাজ পাঁচশো টাকা, এক হাজার টাকা, পনেরশো টাকা আগে টাকা দেন পরে কাজ হবে না দিলে ফাইল ছুড়ে ফেলে দেয় মুখের উপর", negative, low, slow, low  
"আবার নতুন করে লাইসেন্স করাই ভাল, আমিও নতুন করে করতে চাই", neutral, na, na, na  
পাঁচ মাস পরেও একই অবস্থা, negative, low, slow, na  
"সবচেয়ে দুর্নীতিগ্রস্ত অফিস হচ্ছে বিআরটিএ, সাধারণ মানুষদের হয়রানির সীমা থাকে না", negative, low, slow, low  
"আমি লাইসেন্স নবায়ন করতে দিয়েছি, আমার টাকা সব দেওয়া হয়েছে, ফিংগার ও সাক্ষাৎকার সবই দিয়েছি কিন্তু সার্ভার বন্ধ থাকার কারণে ব্যাংক হালনাগাদ করা যাচ্ছে না, আর এইদিকে মাসে মাসে ট্রাফিক সার্জেন্ট এ লাইসেন্সের কারণে পাঁচ হাজার টাকা করে মামলা দিচ্ছে, কি আর করার আমরা তো অসহায়", negative, low, slow, low  
"বছর আড়াই বছর হয়েছে সমস্যার সমাধান হয় না, চোরের বাচ্চারা মিডিয়া দেখলে এরকম কথা বলে", negative, low, slow, low  
"সরকার কর্তৃক জনগণের যেসব কাজ সমাধান হওয়ার কথা ছিল, তা না হয়ে সেগুলো এখন নরকে পরিণত হয়েছে বলে মনে হয়", negative, na, slow, low  
কতগুলো প্রমাণ লাগবে, neutral, na, na, na  
বাংলাদেশে সর্বত্র দুর্নীতি, negative, na, na, low  
সালা সরকারের দালাল, negative, na, na, low  
"উনি মিথ্যুক, আমাকে বলেছে উনি", negative, na, na, low  
সব কুকুরের বাচ্চা এগুলো, negative, na, na, low  
"আমারও একই সমস্যা, আবার টাকা দিতে বলছে", negative, low, slow, low  
ভোগান্তির শেষ নাই, negative, low, slow, na  
"সাংবাদিক ভাই আপনি যে তথ্য বের করেছেন তার জন্য আপনাকে স্যালুট জানাই, আপনার মত সাংবাদিক যদি সত্যের সন্ধানে যায় তাহলে বিআরটিএর প্রত্যেকটি কর্মকর্তাকে টাকার সম্পদের হিসাব দিতে হবে", positive, na, na, high  
ঘুষ মানে বিআরটিএ, negative, low, fast, low  
"ভাই আপনাকে অনেক ধন্যবাদ, ভাই আমার লাইসেন্স শুধু মেয়াদ দেয়", neutral, na, na, na  
"বিআরটিএ চেয়ারম্যান সহ সব কর্মকর্তা কর্মচারীদের স্থায়ী বরখাস্ত না করা পর্যন্ত জনগণ শান্তি ফিরে আসবে না, এখন দরকার ইসলামিক আইন এবং চোর বাটপার ও ঘুষখোরদের হাত না কেটে মাথা কাটার আইন চাই", negative, na, na, low  
"সরকারি চাকুরিজীবীদের পরিবর্তন দরকার, বেসরকারি প্রতিষ্ঠানের লোকজন অনেক দক্ষ, সরকারের উচিত সময়ের সাথে চলতে হলে স্মার্ট দক্ষ কর্মী নেওয়া, বেসরকারি প্রতিষ্ঠান বা বহুজাতিক প্রতিষ্ঠানে চাকরি করা কর্মী নিলে সরকারের দপ্তরে দক্ষতা অনেক বাড়বে", positive, high, na, high  
বিআরটিএকে সকাল বিকেল দুই বেলা থাপ্পড়ানো উচিত, negative, na, na, low  
"প্রতিটি ক্ষেত্রে মানুষের শোষণ, আর কত হবে, এটা কি শেষ হবে না এই দেশ থেকে", negative, na, na, na  
আমার প্রায় ছয় বছর চলে লাইসেন্স দিচ্ছে না, negative, low, slow, na  
"ধান্দাবাজদের শাস্তি দেওয়া উচিত, সবাই আন্দোলন করো", negative, na, na, na  
তিন বছর চলে এখনো হাতে পাইনি, negative, low, slow, na  
"বিআরটিএর সবগুলো কর্মকর্তার জন্ম হয়েছে কুকুরের বীজ থেকে, সব নষ্ট লোকের বাচ্চা ওখানে", negative, na, na, low  
"আমারও একই অবস্থা, আবার নতুন করে করতে হবে, উত্তরা বিআরটিএতে", negative, low, slow, na  
"আরটিভি চ্যানেলকে আর একবার অনুরোধ আরেকটা প্রতিবেদন করার জন্য, আমরা অনেক কষ্টে আছি", neutral, na, na, na  
"আমিও এই সমস্যার ভুক্তভোগী, শুধু তারিখ বাড়িয়ে দিচ্ছেন, এখন পর্যন্ত কোনো তথ্য নেই অবস্থায় আছে, সঠিক তথ্য কবে পাবো জানি না", negative, low, slow, low  
"হজবরল বিআরটিএ অফিস, এরই নাম বাংলাদেশ", negative, low, na, low  
ঐ লোকদের কি অবস্থা হবে এত কতো জনকে দিবেন, neutral, na, na, na  
আমারও একই অবস্থা, neutral, na, na, na  
"আপনাদের একটি প্রতিবেদন করা দরকার এই সমস্যাটি নিয়ে, আমরা এখনো কোনো সমাধান পাইনি, আমরা কি করতে পারি এই বিষয়ে?", negative, na, slow, na  
সর্বকালের সেরা সংবাদ, positive, na, na, high  
এদের বিরুদ্ধে সরকারি ব্যবস্থা নেওয়া উচিত, positive, na, na, high  
এইসব কাজে মাসুদকে লাগবে কারণ মাসুদ ভালো হয়ে গেছে, positive, na, na, na  
সকলেই যদি আমার সাথে একমত থাকেন তাহলে সকলে মিলে একটি বার্তা সরকারের কাছে পাঠাই, positive, na, na, na  
আমি ২০২০ সালে করেছি এখনো পাইনি, negative, low, slow, na  
সরকারের উচিত ড্রাইভিং লাইসেন্স করতে যারা ভোগান্তির শিকার হয়েছে তাদের কাছে ক্ষমা চাওয়া, positive, na, na, high  
"বিআরটিএর সব কর্মকর্তা কর্মচারী অমানুষ, দোজখেও ওদের জায়গা হবে না", negative, na, na, low  
"আগের কোম্পানি পঁইতাল্লিশ হাজার গ্রাহকের টাকা নিয়ে ভাগছে, তারা সরকার দলীয় লোক না হলে এমন করার সাহস পেত না, এই গ্রাহকের টাকা ও তথ্য কোনোদিন ফিরে পাবে না", negative, na, na, low  
"বিআরটিএ মানে ভোগান্তি, হালারা বাটপার, সাংবাদিক ভাইদের ধন্যবাদ এই তথ্য তুলে ধরার জন্য", negative, low, slow, low  
স্মার্ট বাংলাদেশ হলে এই ভোগান্তি থাকবেনা, positive, high, fast, high  
"টাকা কার সুবিধার লিংক থাকে তাদের কার ফোন দেয়, বের হয়ে গাড়ির নিবন্ধন কার্ড দেয় না", negative, low, slow, low  
"ভাই বরিশাল বিআরটিএ তেও এই সমস্যা, দয়া করে ভাই বরিশালের বিআরটিএ নিয়ে একটি প্রতিবেদন করুন", neutral, na, na, na  
আমিও এই ভোগান্তির শিকার, negative, low, slow, na  
বিআরটিএ মাদারবোর্ড, negative, na, na, na  
"আট ঘণ্টা খালি লাইনে দাঁড়িয়ে ছিলাম, বাড়ি এসে জ্বরে পড়ে গিয়েছিলাম", negative, low, slow, na  
"তাদের নামে মামলা করা দরকার, একসাথে পঁইতাল্লিশ হাজার মানুষ যদি মামলা করতো তাহলে বুঝতে পারতো বিআরটিএ কত বড় দুর্নীতিবাজ", negative, na, na, low  
"মাদরাজ সিকিউরিটিজ নামক অযোগ্য ভারতীয় কোম্পানিকে কাজ দেওয়ার চরম ফল, কিন্তু ভোগান্তি সব সাধারণ মানুষের, আমি আমার লাইসেন্সের জন্য ইতিমধ্যে চারবার গিয়েছি, আগামী তারিখ পড়েছে রোজার মধ্যে, জানি না আর কতবার যেতে হবে", negative, low, slow, low  
চোর সব, negative, na, na, low  
যশোর বিআরটিএ মানে দুর্নীতিবাজদের দল, negative, na, na, low  
"আমারও একই, এগুলো ঠিক না", neutral, na, na, na  
ভাই আমারও একই অবস্থা, neutral, na, na, na  
"আমারও একই অবস্থা, স্মার্ট কার্ডের জন্য তিন দিন বিভিন্ন রুমের লাইনে দাঁড়ানোর পর বলছে আমার কোনো তথ্য পাচ্ছে না, অথচ ২০২০ সালের শেষে আমি ড্রাইভিং টেস্ট ও ফিংগারপ্রিন্ট দিয়েও এই ভোগান্তির শিকার, এখন গেলে শুধু তারিখ বাড়িয়ে দেয়, দিন দিন নিজের দেশের প্রতি অনাগ্রহ জন্ম নিচ্ছে", negative, low, slow, low  
ভালো কাজ করেছে বিআরটিএ, positive, high, fast, high  
হারাম খোরের দল, negative, na, na, low  
নিজেরাই সব করছে, negative, na, na, low  
"সব নষ্ট লোকের বাচ্চা চোর, এদের দ্বারা দেশ ও জাতির কোনো পরিবর্তন হবে না", negative, na, na, low  
"মানুষ এমনি এই ড্রাইভিং লাইসেন্স পায় না, আবার যদি সার্ভার না থাকে, ভাগ্য কত খারাপ", negative, low, slow, na  
"সবাই মিলে মামলা করা উচিত, তাহলে ঘুষখোরদের শিক্ষা হবে", positive, na, na, high  
আমিও মাদরাসা প্রিন্টিং দ্বারা ভুক্তভোগী, negative, na, na, low  
চোরের স্বর্গ বাংলাদেশ, negative, na, na, low  
ওদের সর্বনাশ হোক, negative, na, na, na  
"বিআরটিএতে কিছু কর্মচারী আছে তারা তথ্যভান্ডার থেকে তথ্য মুছে দিয়েছে, সহজ কথা", negative, na, na, low  
সব চোর এখন ক্যামেরার সামনে ভিন্ন কথা বলছে, negative, na, na, low  
"অনেক দিন আগে শুনেছিলাম বিআরটিএতে নাকি অনেক ভারতীয় লোক কাজ করে, তাহলে ওরা তথ্য পাচার করে দিল না তো", negative, na, na, low  
হাসিনাকে বিদায় দিন, negative, na, na, na  
সবগুলো নষ্ট লোক, negative, na, na, low  
"যেখানেই বিশ্বাস সাহেবরা আছে, সেখানেই অবিশ্বাস, মামলা করেও তো কোনো লাভ নাই এদেশে, বিআরটিএর দোষে সাধারণ মানুষ পুলিশের হয়রানিতে পড়তে হয়", negative, na, na, low  
যতদিন না তাদের তথ্য সমস্যা সমাধান হচ্ছে ততদিন বিআরটিএ লাইসেন্স রাস্তা ঘাটে চেক করা বন্ধ থাকুক, positive, high, fast, high  
"এটা ডিজিটাল চুরি, ওয়েবসাইটের তথ্য তো তাদের সার্ভারে ছিল, সেটা আবার হারিয়ে যায় নাকি, ডেভেলপার কি ঘাস খায়, সাধারণ মানুষকে ঠকানোর ব্যবসা", negative, na, na, low  
গেম খেলতে খেলতে তথ্য মুছে ফেলেছে হয়তো, negative, na, na, low  
ইডিকে দেখতে চোরের মতো লাগে, negative, na, na, na  
"যেমন সরকার তেমন সরকারি কর্মকর্তা, লুটপাটের কারখানা বিআরটিএ অফিস কর্মকর্তা, অসংখ্য ধন্যবাদ সাংবাদিক ভাইকে", positive, na, na, high  
সব বাটপার, negative, na, na, low  
"আমি ফিংগার দিয়েছি আমার কোনো তথ্য নাই, আরও দুইবার দিয়েছি", negative, low, slow, low  
আমি এর ভুক্তভোগী, negative, na, na, na  
"তথ্য মুছে গেছে, পুনরুদ্ধার না করা গেলে আর কাজ হবে না", negative, na, na, low  
চাকরি পেয়েছে কিভাবে জিজ্ঞেস করুন, neutral, na, na, na  
"এগুলো কেন কোম্পানি ম্যানেজ করবে, সরকারি স্থায়ী কর্মচারী রাখা যায় না, প্রযুক্তি কিনে সরকারি কর্মচারীরাই সব তদারকি করবে", positive, high, fast, high  
"তথ্য হারায় কিভাবে, বলদদের চাকরি দিয়ে রেখেছে, বুঝে সেবা করে না", negative, low, na, low  
টাকা খেয়ে ফালসা করেছে, negative, na, na, low  
ভালো ব্যবসা করেছে, neutral, na, na, na  
অবৈধ সরকার দেশে থাকলে যা হয়, negative, na, na, low  
সরকার শেষ, neutral, na, na, na  
আমার ২০১৯ সালের লাইসেন্স এখন পাইনি, negative, low, slow, na  
"আরটিভি সাংবাদিক ভাইকে অসংখ্য ধন্যবাদ, আপনাদের এই প্রতিবেদন মাননীয় প্রধানমন্ত্রীর চোখে পড়লেই কেবল এই সমস্যার সমাধান হবে, যেখানে সকল মন্ত্রণালয় দ্রুত সেবা দেওয়ার অঙ্গীকার করে কাজ শুরু করেছে, সেখানে এরা আমাদের নিয়ে খেলা করছে", positive, na, fast, high  
"দালাল নষ্ট লোকগুলো সব, বাংলাদেশ শেষ, বেশিদিন আর চলবে না, শ্রীলঙ্কা আর পাকিস্তানের রাসায় যাবে বাংলাদেশ", negative, na, na, low  
মাদ্রাজ সিকিউরিটি প্রিন্টার্স মিরপুর ১২ ... জনগণের ভোগান্তি কমিয়ে আনার আহ্বান করছি, negative, low, slow, low  
বিআরটিএর কিছু করার ক্ষমতা নেই, negative, na, na, low  
