text,sentiment,eof,responsiveness,accuracy
"২০২২ সালের ডিসেম্বর মাসে আবেদন করেছি, ফেব্রুয়ারি ২০২৩ এ পরীক্ষা দিয়ে পাশ করেছি, এখনো ডেলিভারি স্লিপ হাতে পাইনি", negative, low, slow, low
"অপেশাদার লাইসেন্স বাড়িতে গিয়ে দেয়, পেশাদার লাইসেন্স দুই তিন বছর পর কার্ড পাওয়া যায়", negative, low, slow, low
ভুয়া নিউজ কেন প্রকাশ করেন, negative, na, na, na
"সব মিথ্যা কথা, ২০২২ সালের ডিসেম্বর মাসে আবেদন করেছি, জুলাই ২০২৩ এ লাইসেন্স পাবো বলেছে বিআরটিএ", negative, na, na, low
এই জন্যই তোদের সার্ভার ঠিক করতে এতদিন লাগছে, negative, na, slow, na
"অফিসে যেতে যেতে পায়ের চামড়া ক্ষয় হয়ে গেছে, আর বলছেন ২০ দিনে লাইসেন্স পাবো", negative, low, slow, na
দুই বছর আগে ড্রাইভিং করেছি এখনো কার্ড পাইনি, negative, low, slow, low
Very good, positive, na, na, na
"বগুড়ায় অভিযান দেন, অনেক লাইসেন্স আটকে আছে", neutral, na, na, na
"ফালতু নিউজ কেন দেন, তিন মাসে দেয়ার কথা, সেখানে বছর পার হয়ে যাচ্ছে", negative, low, slow, na
"১৫ মাস হয়ে গেছে এখনো ড্রাইভিং লাইসেন্স পাইনি, ২০ দিনে পাওয়ার কথা বলছেন", negative, low, slow, low
তাই, neutral, na, na, na
"পরীক্ষা দিলাম ১৬-০৫-২০২৩ কিন্তু লার্নার দিয়ে রেখেছে, কবে দিবে বলেনি", negative, low, slow, na
চোরের মার বড় গলা, negative, na, na, na
আমার লেয়ারা হবে চোরের বাচ্চারা, negative, na, na, na
এই বিআরটিএ দেওয়ালের ইট পর্যন্ত ঘুষ খায়, negative, na, na, na
"এটা শুধু ঢাকাতেই হচ্ছে, অন্য জেলায় শুরু হয়নি", neutral, na, na, na
বাটপার, negative, na, na, na
সেপ্টেম্বরে বায়োমেট্রিক দিয়েছি এখনো কার্ড পাইনি, negative, low, slow, low
"চুপ, মিথ্যাবাদী ঘুষখোরের দল", negative, na, na, na
"নতুন নতুন নাটক চলছে, আমার লাইসেন্স ডেলিভারি ডেট ছিল ১২ মার্চ ২০২৩, এখনো পাইনি আবার ডেট দিয়েছে ২২ জুন ২০২৩", negative, low, slow, na
"বাংলাদেশের দুর্নীতির মধ্যে সবচেয়ে বেশি হচ্ছে বিআরটিএ অফিসের দুর্নীতি, টাকা ছাড়া কেউ কথা বলে না", negative, na, na, na
"মাননীয় মহোদয়, মিথ্যা বলছেন, দুই বছর আগে লাইসেন্স দিয়েছি এখনো আসেনি", negative, low, slow, low
"ফালতু নিউজ, আমার ফিঙ্গারের ডেট ছিল, এখন বলে এসএমএস গেলে আসবে", negative, na, slow, na
"তথ্য দিয়ে সাহায্য করুন, নিবন্ধন করতে চেষ্টা করছি কিন্তু ফোনে ওটিপি কোড আসছে না", negative, low, slow, low
এক বছর ধরে এক টুকরা কাগজ নিয়ে কষ্টে চলছি, negative, low, slow, na
"নাউজুবিল্লাহ, ডাহা মিথ্যা কথা কেন বলেন, ৪ বছর পূর্ণ হলো লাইসেন্স করতে দিয়েছিলাম এখনো হাতে পাইনি, আবারও রিনিউ করার সময় হয়ে গেছে, কবে পাবো জানিনা", negative, low, slow, low
"Thanks sir, বাংলাদেশের সব সরকারি দফতর এই রকম হওয়া দরকার", positive, high, fast, high
"একটা সাজেশন দিই, কিছু করতে হবে না, অভিযোগ নিন অনলাইনে আর শাস্তি নিশ্চিত করুন, তখন কেউ টাকা নেবে না", positive, moderate, moderate, moderate
"টাকা না দিলে ফেল, টাকা দিলে পাস এমন হবে", negative, low, slow, low
"একটি অফিসে ভিড় কম, এখন সুযোগ আছে, পাবলিক প্লেসে সবাইকে বোঝানো হচ্ছে, এখন আর বিআরটিসিতে কোন জ্যাম নেই", positive, moderate, fast, high
আবার এক দালাল ব্যবসা করছে, negative, na, na, na
"পেশাদার ড্রাইভিং লাইসেন্স নবায়ন করতে দিয়েছি ২০১৯ সালে, এখনও লাইসেন্স কার্ড হাতে পাইনি", negative, low, slow, low
I applied 3 months ago. Didn’t get it, negative, low, slow, low
"বুঝলাম না, রিনিউ করতে দিলাম, ছবি আর ফিঙ্গার দিলাম, ৬ মাস হয়েছে এখনো লাইসেন্স পাইনি", negative, low, slow, low
Bangladesh, neutral, na, na, na
"আগে কার্ড অফিসে আছে, তাই এখনো পাইনি", negative, low, slow, na
ডোপ টেস্ট এর সিস্টেম বাদ দেওয়া দরকার, negative, na, na, na
"গাড়ি চালানো লাগবে না, বিআরটিএতে না গেলে পরীক্ষা কোথায় দিবো, সব অনলাইনে?", neutral, na, na, na
শালা বাটপার, negative, na, na, na
প্রতিনিয়ত এই ধরনের বাজে গল্প শুনে মানুষ বিরক্ত, negative, na, na, na
কত ভুল ধরবো আর, negative, na, na, na
শুনতে ভালো লাগছে, positive, na, na, na
"গত বছর নভেম্বরে নতুন কোম্পানি মাদ্রাজ প্রিন্টার্সে ফিঙ্গার দিলাম, মে মাসেও কার্ড পাইনি, অথচ নতুনরা ২০ দিনে কার্ড পাচ্ছে, এটা ভাঁওতাবাজি ছাড়া কিছু নয়, ওয়েবসাইটও কাজ করে না, টাকা দিলে পাস, না দিলে ফেল, বিআরটিএ বাংলাদেশের সবচেয়ে দুর্নীতিগ্রস্ত প্রতিষ্ঠান", negative, low, slow, low
তোদের লজ্জা থাকা উচিত, negative, na, na, na
"ধুর বাটপার, এক বছর হয়ে গেল এখনও ড্রাইভিং লাইসেন্স পাইনি", negative, low, slow, low
রাইট বলছেন স্যার, positive, na, na, na
"আমার ড্রাইভিং লাইসেন্সে জন্মসালে ভুল আছে, অনেক চেষ্টা করেও ঠিক করতে পারিনি, তাহলে আমার জীবন কি বেফলে যাবে?", negative, low, slow, low
"আলহামদুলিল্লাহ, যদি এরকম হয় তাহলে ভালো", positive, na, na, na
কথার সাথে কাজের কোন মিল নেই, negative, na, na, na
সব চোর, negative, na, na, na
"আমি চ্যানেল ২৪ কে দৃষ্টি আকর্ষণ করছি, ২০১৯ সালে লাইসেন্সের জন্য আবেদন করেছি, আজও হাতে পাইনি, কতবার গিয়েছি তবুও কার্ড আসেনি, তাহলে কি মৃত্যুর পর আসবে?", negative, low, slow, low
"আট-দশ মাস যাবৎ স্মার্ট কার্ড পাচ্ছি না, আবার বলে বাসায় পৌঁছে দেবে", negative, low, slow, low
"নিয়ম অনেক বানানো যায়, বাস্তবায়ন করে দেখান", neutral, na, na, na
Owe, neutral, na, na, na
"আমাদের সমস্যা কি, পাঁচ মাস হয়েছে এখনও ড্রাইভিং লাইসেন্স পাইনি", negative, low, slow, low
"মোহাম্মদ জামাল হোসেন এর লাইসেন্স টা কি হয়েছে, ঢাকা মেট্রো", negative, na, na, na
"সাথে সাথে বহিষ্কার করুন এবং গ্রেপ্তার করুন, আমরা ন্যায়বিচার চাই", negative, na, na, na
"যারা আইন মানে না, ঘুষখোর দুর্নীতিবাজ, তাদের সরকারি চাকরি থেকে বহিষ্কার করুন, এরা দেশের শত্রু", negative, na, na, na
"যারা আইন মানে না, ঘুষখোর দুর্নীতিবাজ, তাদের সরকারি চাকরি থেকে বহিষ্কার করুন, এরা দেশের শত্রু", negative, na, na, na
"ওখানে মাওলানা কে নিয়োগ দেন, তাদের ব্যাংক ডিটেলস চেক করুন, মামলা দিন", negative, na, na, na
এদের বিচারের আওতায় না আনলে এরা হয়রানি বন্ধ করবে না, negative, na, na, na
দুই বছর হচ্ছে স্মার্ট কার্ড দিচ্ছে না দিনাজপুর, negative, low, slow, low
"২০১৯ সালে আমি ফিঙ্গার দিয়েছি, রশিদও আছে, এখন বলছে নতুন করে টাকা জমা দিতে হবে", negative, low, slow, low
আমি দুই বছর ধরে লাইসেন্স পাইনি, negative, low, slow, low
"আমি ৪ বছর ধরে ঘুরছি, এখনো পাইনি লাইসেন্স", negative, low, slow, low
"আমিও, আপনাদের নাম্বারটা দিন", neutral, na, na, na
"দালাল ছাড়া পাস করা যায় না, ঘুষ ছাড়া নয়", negative, low, slow, low
"আমরা কি দেশে চুরি ডাকাতি করে খাবো নাকি মরবো, সরকারের কাছে জানতে চাই", negative, na, na, na
"আমি ২০২১ সালে হালকা থেকে ভারী করার জন্য আবেদন করেছি, ২০২২ সালে ফিঙ্গারও দিয়েছি, কিন্তু এখনো কিছু হয়নি, আমি সাংবাদিকদের কাছে অনুরোধ করছি বিষয়টা তুলে ধরুন", negative, low, slow, low
পুতুল খেলা মনে করছে সরকারি কর্মকর্তারা, negative, na, na, na
নুরমোহাম্মদ মজুমদারকে জুতার মালা গলায় দিয়ে ঘোরানো উচিত, negative, na, na, na
"আমার লাইসেন্স মিডিয়াম করার জন্য দিয়েছি, ফিঙ্গার ও টাকা দিয়েছি, কিন্তু লাইসেন্স পাচ্ছি না", negative, low, slow, low
মনে চায় লাইসেন্স ছাড়াই গাড়ি চালাই আর যদি কেউ কিছু কয় তাহলে তারে ধইরা মাইরা লাই এতো কান্না হয়রানি যা বলার বাইরে কান্না, negative, na, na, na
এরপর কি কোনো অবস্থা দেখায়?, neutral, na, na, na
আসসালামু আলাইকুম ভাই কে প্রতিবেদনটা করেছেন জানি না আমিও এই সমস্যায় ভুগতেছি আজকে এক বছর। লাইসেন্স করতে দিয়েছি হালকা থেকে মাঝারি আঙুলের ছাপ বায়োমেট্রিক একই দিনে এক বছর হয়ে গেল এখন পর্যন্ত আমাদের কোন টাকা জমা হয় নাই, negative, na, slow, na
ওনার মতই আমার একই সমস্যা কান্না, negative, na, na, na
সহায়তা লাগবে, neutral, na, na, na
সব মিথ্যা কথা। লাইসেন্স খুঁজে পাওয়া যাচ্ছে না, negative, na, na, low
আমার আঙুলের ছাপ হয়ে গেছে দুই হাজার একুশ সালে। শুধু তারিখে ঘুরাচ্ছে। স্মার্ট কার্ড হাতে পাচ্ছি না। শেষে শুনি আমার তথ্য নেই অনলাইনে। কিন্তু আঙুলের ছাপ সম্পন্ন হয়েছে হাসি হাসি, negative, na, slow, low
লাইসেন্স নবায়ন করার জন্য দিয়েছি বিশ সালের পর্যন্ত একটা খবর প্রচার করতে পারেন না, negative, na, na, na
টাকা দেন এদের একদিনে জয়বাংলা করে দিবে???, negative, na, fast, na
দেশ এখন স্মার্ট আমি এক বছর ধরে ঘুরেছি, negative, na, na, na
ভাই পরীক্ষা দিলাম ব্যাংক দিচ্ছে না কবে ব্যাংক হবে আল্লাহই জানেন, negative, na, slow, na
"যে দেশে লাইসেন্স পেতে হলে জীবনের যুবক বয়স থেকে বার্ধক্য পর্যন্ত চলে যেতে হয়, সেখানে আবার রাস্তার মোড়ে মোড়ে পুলিশ চেকপোস্ট, বিষয়টা নিতান্তই হাস্যকর হাসি", negative, na, na, na
হাসি, neutral, na, na, na
"ডিএল চেকার দিয়ে দেখেছি প্রিন্ট হয়েছে আরো এক মাস আগে, হাতে এখনো পাইনি", negative, na, slow, na
প্রথম ভাইয়ের মতো আমারও একই অবস্থা, negative, na, na, na
আট মাস ধরে তারিখের পরে তারিখ দিচ্ছে আজকেও তারিখ দিয়ে পাঠিয়ে দিল আর কতদিন লাগবে আল্লাহ আর অফিস ভালো জানে, negative, na, slow, na
এত মন্তব্য তাও ওদের চোখে পড়ে না ওরা অন্ধ হয়ে গেছে অফিসের লোকজন সব, negative, na, na, na
স্যার আমি দুই হাজার বাইশ সালে ড্রাইভিং লাইসেন্স করতে দিয়েছি এখন সমস্যা হচ্ছে আমি অফিসে গিয়ে প্রশিক্ষণ দিয়ে এসেছি গাড়ি চালিয়ে দেখিয়েছি এরপর আমাকে বলছে তিন মাসের মধ্যে লাইসেন্স দিবে কিন্তু আজ পর্যন্ত আমার লাইসেন্স দেয় নাই আমি ড্রাইভিং লাইসেন্স চাওয়াতে আমাকে বলছে আপনার লাইসেন্স বাতিল করা হলো আবার করলে নতুন করে পনের হাজার টাকা দেন কাগজপত্র দিতে হবে না আগের কাগজপত্র দেয়া আছে তাতেই হবে এখন আমি কি করব, negative, na, slow, na
এই হলো হাসিনার ডিজিটাল বাংলাদেশ কান্না কান্না এক বছর হয়ে গেল এখনো কার্ড হাতে পেলাম না। এক বছর ধরেই ছাপার জন্য প্রস্তুত দেখাচ্ছে, negative, na, slow, na
দালাল ছাড়া পাশ হয় না, negative, low, na, na
মাসুদ ভালো হয়ে যায়নি এখনো হাসি হাসি হাসি, negative, na, na, na
দুইবার পরীক্ষা দিয়ে পাশ করেছি তবুও ফেল দিচ্ছে, negative, na, na, low
লোকটা কি বললো আগামী দুই মাস পার হয়ে গেল আজ গিয়ে পেলাম না আবার তারিখ দিল কলা মুখভঙ্গি মুখভঙ্গি মুখভঙ্গি, negative, na, slow, na
এক বছর হলো কার্ড নাই, negative, na, slow, na
"লুটপাটের দেশ বাংলাদেশ, ভোগান্তির দেশ বাংলাদেশ, ঘুষের সেরা দেশ বাংলাদেশ, মিথ্যা মামলার দেশ বাংলাদেশ, গুম খুনের দেশ বাংলাদেশ, আমি লজ্জিত বাঙালি", negative, na, na, na
চোরের দল। কাজের প্রতি আলসেমি, negative, na, na, na
আসসালামু আলাইকুম স্যার ঢাকা কুরিয়া অফিস উনত্রিশ জানুয়ারি দুই হাজার তেইশ হালকা থেকে মাঝারি জন্য পরীক্ষা দিয়েছিলাম পাশ করেছিলাম কিন্তু বায়োমেট্রিক দিতে পারি নাই সার্ভারে সমস্যা ছিল কবে চালু হবে, negative, na, slow, na
প্রেরিত লেখা উঠছে বিগত ছয় মাস ধরে দুঃখ আল্লাহই জানেন কবে পাবো স্মার্ট কার্ড নিরুত্তাপ, negative, na, slow, na
"পনের হাজার টাকা দিলেই দেখি তিন মাসের মধ্যে দিয়ে দিচ্ছে, আর টাকা না দিলে এটা পাওয়া দুঃস্বপ্ন", negative, na, fast, na
হাসি, neutral, na, na, na
আমারও একই অবস্থা, negative, na, na, na
আমার এক বছর গেছে সব হবার পরে, negative, na, na, na
আজকে ভারী লাইসেন্সের আঙুল দিয়েছি দশ মাস আগে এখনো টাকা জমা দিতে পারি নাই আর কবে, negative, na, slow, na
মাঝারি থেকে ভারী লাইসেন্সের সার্ভার খুলবে কবে, negative, na, na, na
একটু ভালো করে বলেন ভাই আমরা আর পারছি না, negative, na, na, na
টেলিভিশনকে ধন্যবাদ তিন মাস কেন অফিস যে অবস্থা নয় মাসে আমরা লাইসেন্স পাব না, negative, na, slow, na
অফিস মানেই ভোগান্তি। এটি সেনাবাহিনীর দেওয়া উচিত, negative, na, na, na
আসসালামু আলাইকুম আমি চট্টগ্রাম অফিসে নতুন লাইসেন্স করতে আবেদন করেছিলাম এক বছর পূর্ণ হলো এখনো লাইসেন্স হাতে পাইনি, negative, na, slow, na
"অফিস নরসিংদীতে আঙুল দিলাম ছবি দিলাম আজ আট মাস লাইসেন্সের আজও লাইসেন্সের দেখা মিলল না আর প্রতারক চেয়ারম্যান বলে আরও দুই তিন মাস, সারা শরীরে ঘা মলম কোথায় লাগাবো বুঝিনা", negative, na, slow, na
আমিও একজন চালক লাইসেন্সের মেয়াদ শেষ ছয় মাস আগে আমি তিন মাস মেয়াদ থাকতে লাইসেন্স দিয়েছি এক বছরও পেলাম না রাস্তাঘাটে পুলিশের হয়রানি পাঁচ হাজার টাকা মামলা সম্পূর্ণ অফিসের কারণে, negative, na, slow, na
আমিও ভুক্তভোগী আঙুলের ছাপ দিয়েছি কিন্তু ব্যাংকে টাকা জমা নিচ্ছে না বলে সার্ভার সমস্যা কান্না, negative, na, slow, na
আমি দুই হাজার বিশ সালে লাইসেন্স নবায়ন করতে দিয়েছি দুঃখের বিষয় হলো আমি তিন বছর পরে কার্ড পেয়েছি পেলে লাভ কি সেই লাইসেন্স নবায়ন হয় নাই আমার নয় হাজার টাকা গেছে আমি আবার নতুন করে লাইসেন্স নবায়ন করতে হয়েছে আবার আমার দশ হাজার টাকা গেছে, negative, na, slow, na
আমি দুই হাজার বাইশ সালের ডিসেম্বর মাসের একুশ তারিখে মাঝারি ড্রাইভিং লাইসেন্সের জন্য আবেদন করেছি দুই হাজার তেইশ সালের ফেব্রুয়ারি মাসের কুড়ি তারিখে পরীক্ষা ও আঙুলের ছাপ একই দিনে দিয়েছি টাকা জমা দেওয়ার সবকিছু শেষ কিন্তু সরবরাহ পত্র এমনকি অনুমোদনপত্র দেয়নি তাহলে আমি কিভাবে বর্তমানে গাড়ি মিডিয়ার মাধ্যমে জানতে পারি, negative, na, slow, na
ওনারা মৃত্যুর আগ পর্যন্ত এভাবেই চেষ্টা করে করে যাবেন কিন্তু সাধারণ মানুষ ঠিক কবে কখন এই সমস্যা থেকে মুক্তি পাবে তার আর কোনো সময়সীমা নাই, negative, na, na, na
কি বলবো বলার ভাষা নাই না দিলে ড্রাইভিং লাইসেন্স হয় না জীবন থাকে না এশিয়ার ভালো কাজ আশা করা যায় না যতগুলি অমানুষ ভর্তি করছে অফিসের প্রশিক্ষণ কেন্দ্রে, negative, na, na, na
অযোগ্য লোকদের বসিয়ে রাখলে যা হয় আর কি, negative, na, na, na
