text,sentiment,eof,responsiveness,accuracy
"স্মার্ট কার্ড দুই মাস ধরে প্রিন্টে আছে, প্রিন্ট শেষ হবে কবে আল্লাহ জানেন", negative, na, slow, na
গাড়ির মালিকানা পরিবর্তন করে দেওয়ার মত কেউ কি আছেন, neutral, na, na, na
মিরপুর বিআরটিএ এর কেউ থাকলে যোগাযোগ করবেন দয়া করে, neutral, na, na, na
"২৫ জুলাই পরীক্ষা ছিল, নতুন পরীক্ষার তারিখ কবে পাবো বা পরীক্ষা কবে হবে", neutral, na, na, na
হটলাইনে ফোন দিলেও কেউ ধরে না, negative, na, slow, na
"২৩ জুলাই পরীক্ষা ছিল, নতুন পরীক্ষার তারিখ কবে দেওয়া হবে", neutral, na, na, na
"দীর্ঘ তিন বছর যাবৎ নবায়নের জন্য ঝুলছে, আর কতদিন লাগবে লাইসেন্স পেতে দয়া করে জানান", negative, low, slow, na
"হাইওয়েতে অটো রিকশা ও সিএনজি ফিটনেসবিহীন যান যদি ট্যাক্স ছাড়া চলতে পারে, তাহলে প্রাইভেট কারের কি দোষ, ট্যাক্স দিব না আর", negative, na, na, low
"আমার চোখের সমস্যার কারণে ব্রাহ্মণবাড়িয়া বিআরটিএ তে যাওয়ার পর কোনো ধরনের সাহায্য পাচ্ছি না, এর কি সমাধান হতে পারে", negative, na, na, na
আগামী ৩০ তারিখ পর্যন্ত করার জোর দাবি জানাচ্ছি, neutral, na, na, na
নবায়ন ফি জমা দেওয়ার সময় ৩০ সেপ্টেম্বর পর্যন্ত বৃদ্ধির জোর দাবি জানাচ্ছি, neutral, na, na, na
আপনারা কি ইনবক্স বার্তা দেখেন না, negative, na, na, na
"সাপোর্ট সেন্টারের নাম্বার দিয়েছেন, কল তো কেউ রিসিভই করে না। ৬ই আগস্ট ফিটনেসের মেয়াদ শেষ হয়েছে, ১৬ই সেপ্টেম্বর পর্যন্ত জরিমানা ছাড়া নবায়নের সুযোগ ছিল, এদিকে অ্যাপয়েন্টমেন্টের স্লট ২৪শে সেপ্টেম্বরের আগে পাওয়া যাচ্ছে না। যেহেতু অ্যাপয়েন্টমেন্টের স্লট দিতে পারছেন না, দরকার ছিল জরিমানা ছাড়া আরও কিছুদিন নবায়নের সুযোগ দেওয়া", negative, low, slow, na
ফিটনেস নবায়নের ফি পরিশোধ করা হয়েছে। এখন পূর্বের ফিটনেসের মেয়াদ শেষ হবার পর ফিটনেস নবায়নের অ্যাপয়েন্টমেন্ট নিলে কি জরিমানা দিতে হবে? পূর্বের ফিটনেসের মেয়াদ শেষ হবার আগে ফিটনেসের জন্য বিআরটিএ মিরপুর বা উত্তরাতে কোনো অ্যাপয়েন্টমেন্ট স্লট পাওয়া যাচ্ছে না, negative, low, na, na
"বিআরটিএ একটি স্মার্ট কার্ড সেবা দিতে পারে না, ৫ মাস ২২ দিন ধরে। এটা নাকি আমাদের স্মার্ট বাংলাদেশ। বিআরটিএ কর্মকর্তাকে বলছি, যদি আপনারা একটি স্মার্ট কার্ড সেবা দিতে না পারেন, তাহলে বিআরটিএ ছেড়ে চলে যান। দালাল দিয়ে তো সব কিছু হচ্ছে, দালালমুক্ত হলো কোথায়", negative, low, slow, low
হর্ন নামক অভিশাপ থেকে আমরা মুক্তি চাই। সামান্য ধৈর্য আমাদের সমাজকে আরো সুন্দর করতে পারে। এখন রাস্তায় বের হলে খুবই অনিশ্চয়তার মধ্যে থাকি কারণ অটোরিকশা এবং যানবাহন যেভাবে বাড়ছে তত বেশি শব্দদূষণ বাড়ছে। তাই অযথা কেউ হর্ন বাজালে আমরা সকলে নিজ নিজ জায়গা থেকে নিষেধ করি। এভাবেই একদিন দেশটা সুন্দর হয়ে উঠবে, positive, na, na, na
"অযান্ত্রিক যানবাহনের জন্য সব ফ্রি যেমন ট্রলি, নসিমন, ট্রাক্টর, গরুরগাড়ি, ভটভটি, ইজিবাইক ইত্যাদি, এগুলো তো এক টাকাও ট্যাক্স দেয় না, সরকার নেয়ও না। কিন্তু কেন জানতে পারি", negative, na, na, na
"আমার বাইকের নাম ট্রান্সফার করিয়েছি আড়াই বছর আগে, এখন গাড়ি আমার নামে হয়েছে কিনা কিভাবে চেক করবো, বিএসপি পোর্টালে সব কিছু দিলেও বলে কোনো গাড়ি পাওয়া যায়নি। অথচ কয়েক মাস আগেও ট্যাক্স টোকেন করেছি এবং তাদের কাছে গাড়ির তথ্য চলে এসেছে। কেউ সাহায্য করতে পারলে উপকৃত হবো", negative, na, na, na
"গাড়ির জন্য পরিবেশ সারচার্জ গত সরকারের নেওয়া সিদ্ধান্ত বর্তমান সরকারের সময় কার্যকর হয়েছে বিগত তিন দিন থেকে। এতে অতিরিক্ত আয়ের বোঝা, তার উপর একজনের নামে একাধিক প্রাইভেট গাড়ি থাকলে একাধিক গাড়ির উপর এই সারচার্জ প্রযোজ্য হবে। আমার প্রশ্ন হলো, গাড়ি দ্বারা পরিবেশের যে ক্ষতি হলো তা এই টাকা দিয়ে কিভাবে পূরণ করবেন", negative, na, na, na
কারো যদি দুটি হাইব্রিড গাড়ি থাকে তবে তাকেও কি পরিবেশ সারচার্জ দিতে হবে। আর হাইব্রিড গাড়িতে যদি সারচার্জ আরোপ করা হয় তবে টমটম ও অটোরিকশাতেও পরিবেশ সারচার্জ আরোপ করা হোক, neutral, na, na, na
গাড়ির ইঞ্জিন খুলে ব্যাটারি লাগিয়ে রাস্তায় চালাবো, negative, na, na, na
"ট্যাক্স টোকেন, ফিটনেস, অতিরিক্ত আয়কর, তার পর এটাও যোগ হবে", negative, na, na, na
আপনারা গণপরিবহন আধুনিক করুন, positive, na, na, na
আইনি পদক্ষেপ নেওয়া জরুরি হয়ে পড়েছে, negative, na, na, na
আইন আছে, neutral, na, na, na
"কার্যকর হওয়ার সম্ভাবনা কম, কারণ যেসব গাড়ি হাইওয়েতে চলতে পারবে না তাদের জন্য বিকল্প রাস্তার ব্যবস্থা আগে করতে হবে", neutral, na, na, na
"আজীবন এমন নোটিশ দেখে আসছি, কার্যকর দেখিনি", negative, na, na, na
"এগুলো লোক দেখানো নোটিশ, পূর্বাচল ৩০০ ফিট রাস্তায় আইন মানানো হয় না, হাইওয়েতে এসব যানবাহন আপনারা নোটিশ মানে না", negative, na, na, low
"কি অবস্থা, রাস্তায় গাড়ি চালাতে গেলে অটো রিকশা ধরে ধরে পাশে করে চালাতে হয়", negative, na, na, na
সাত কর্মদিবস, neutral, na, na, na
হাতে পেতে কত দিন লাগতে পারে ভাইজান, neutral, low, slow, na
কোন জেলা, neutral, na, na, na
গাজীপুর, neutral, na, na, na
আর তিন দিন, neutral, na, na, na
এমডি কামরুল হাসান গাজীপুর, neutral, na, na, na
আহমেদ আশরাফুল আর তিন দিন, neutral, na, na, na
এমডি কামরুল হাসান ভাইজান কার্ড পাঠিয়ে দিলে কি অবস্থা পরিবর্তন হয় আর তেজগাঁও ডাক প্রসেসিং সেন্টার থেকে কি আমার কার্ড ছাড়ছে, neutral, na, na, na
এমডি কামরুল হাসান ধন্যবাদ ভাইজান ভালোবাসা, positive, na, na, na
আহমেদ আশরাফুল ছাড়ছে, neutral, na, na, na
ভাই পরীক্ষা দেওয়ার কতদিন পরে এই বার্তাটি আসছে, neutral, na, na, na
ফিটনেস ফি জরিমানা মওকুফের নতুন সময় দেওয়া হোক, neutral, na, na, na
"আমার বাইকের নাম হস্তান্তর করেছি আড়াই বছর আগে এখন গাড়ি আমার নামে হয়েছে কিনা কিভাবে চেক করবো, বিএসপি পোর্টালে সব কিছু দিলেও বলে কোনো গাড়ি পাওয়া যায়নি অথচ কয়েক মাস আগেও কর আদায় করেছি এবং তাদের কাছে গাড়ির তথ্য চলে আসে, কেউ সাহায্য করতে পারলে উপকৃত হবো", negative, na, na, low
"প্রশিক্ষিত চালক প্রয়োজন, দেশে নিরাপদ সড়কের জন্য। নিরাপদ সড়কের কথা সবাই বলে কিন্তু প্রশিক্ষিত চালক বা আন্তর্জাতিক মানের ড্রাইভিং স্কুল নিয়ে কেউ কথা বলে না। বাংলাদেশে লাইসেন্স পাওয়া যায় চুক্তিতে, নামে মাত্র পরীক্ষা নেয় যা খুবই নিম্নমানের। এই দেশে প্রয়োজন হলো যাদের লাইসেন্স আছে ও যাদের লাইসেন্স নেই সবাই যারা গাড়ি চালাবে তাদের প্রশিক্ষণ নিয়ে আবার পরীক্ষা দিয়ে গাড়ি চালানো। তা না হলে শুধু আইন করে জরিমানা বাড়িয়ে দুর্ঘটনা কমানো যাবে না। যেমন রাস্তাই বানান না কেন, নিরাপদ নয়। হয়তো আমি আপনি মারা যাবো না হয় আপনজন হারাবো অথবা আজীবনের জন্য পঙ্গুত্ব বরণ করবো। হাসপাতালে দুর্ঘটনার কেসগুলো দেখে আসুন প্রতিদিন কত মানুষ আহত হচ্ছে, আহত মানে সারাজীবন কষ্ট। আর রিকশা, মোটর রিকশা, অটোরিকশা, ঠেলাগাড়ি, ভ্যানগাড়ি, নসিমন এসবের জন্যও আলাদা লাইন করা, এদেরও কিছু বিনামূল্যে প্রশিক্ষণ দেওয়া। আর সবচেয়ে বেশি প্রয়োজন বাস সার্ভিসে গুরুত্ব দেওয়া যাতে মানুষ বাসে যাতায়াতে আগ্রহী হয়", negative, na, na, high
কবে পাবো জানতে চাই, neutral, na, na, na
"সাতক্ষীরা থেকে শ্যামনগর পর্যন্ত এই রাস্তাটার বেহাল দশা, একটু নজর দেওয়া যায়", negative, na, na, na
"অবশ্যই পারবেন, বাংলাদেশের থাকতে হবে, পরীক্ষার দিন", neutral, na, na, na
পারবেন সাহায্য লাগলে ইনবক্সে বার্তা দিন, neutral, na, na, na
জি পারবেন, neutral, na, na, na
এখন ভারী গাড়ির জন্য আবেদন করতে হবে, neutral, na, na, na
"আমি তো ভাই প্রবাসে আছি কি করে আবেদন করবো, প্রবাসে থেকে কি আবেদন করা যাবে", neutral, na, na, na
"না, সরাসরি আঙুলের ছাপ দিতে হবে", neutral, na, na, na
তাহলে মেয়াদ শেষ হয়ে যাবে, negative, na, na, na
ধন্যবাদ, positive, na, na, na
টাকা জমা দেওয়ার পর কি সরকারি ছুটি ছিল, neutral, na, na, na
সর্বোচ্চ সাত কর্মদিবস, neutral, na, na, na
জানি না, neutral, na, na, na
কালকে বা পরশুর মধ্যে পেয়ে যাবেন ভাই, neutral, na, fast, na
"আমি চার তারিখে টাকা দিয়েছি, এখনো পাইনি, আজ উনিশ তারিখ", negative, na, slow, na
বার্তা আসবে আপনার নাম্বারে কাগজের জন্য, neutral, na, na, na
"আবেদনের অবস্থা দেখুন, সেখানে কি অনুমোদনের জন্য অপেক্ষমান এই লেখাটি আসছে", neutral, na, na, na
"ভাই আমি চট্টগ্রাম থেকে লাইসেন্স বানিয়েছি, আমি কি এখন ঢাকা থেকে নবায়ন করতে পারবো", neutral, na, na, na
এই অ্যাপসের নাম কি যদি কেউ বলেন, neutral, na, na, na
"বিআরটিএ যোগাযোগ করুন, পেয়ে যাবেন, ইনশাল্লাহ", positive, na, na, na
পরীক্ষা দেওয়ার কতদিন পরে এই অবস্থা আসছে, neutral, na, na, na
কিভাবে বুঝবো যে আমার লাইসেন্স এসেছে, neutral, na, na, na
"কয়েকদিন অপেক্ষা করুন, আমারও কয়েকদিন আগে একই দেখাচ্ছিল, পরে সাত দিন মতো লেগেছে আসতে, আবার নতুন করে একটা বার্তা আসবে অফিসে পৌঁছালে তখন গিয়ে নিতে পারবেন", neutral, na, moderate, na
আমার লাইসেন্স নবায়ন করা যাবে কিভাবে চট্টগ্রামে, neutral, na, na, na
বিআরটিএ কল সেন্টার পুরোপুরি সক্রিয় করার অনুরোধ জানাচ্ছি, negative, na, slow, na
ফিটনেস ফি জরিমানা মওকুফের নতুন সময় দেওয়া হোক, neutral, na, na, na
আপনাদের সহায়তা লাইনে কল দিলে তো কেউ রিসিভ করে না, negative, na, slow, na
"আমার বাইকের নাম হস্তান্তর করেছি আড়াই বছর আগে এখন গাড়ি আমার নামে হয়েছে কিনা কিভাবে চেক করবো, বিএসপি পোর্টালে সব কিছু দিলেও বলে কোনো গাড়ি পাওয়া যায়নি অথচ কয়েক মাস আগেও কর আদায় করেছি এবং তাদের কাছে গাড়ির তথ্য চলে আসে, কেউ সাহায্য করতে পারলে উপকৃত হবো", negative, na, na, low
হর্ন নামক অভিশাপ থেকে আমরা মুক্তি চাই। সামান্য ধৈর্য আমাদের সমাজকে আরো সুন্দর করতে পারে। এখন রাস্তায় বের হলে খুবই অনিশ্চয়তার মধ্যে থাকি কারণ অটোরিকশা এবং যানবাহন যেভাবে দিন দিন বাড়ছে তত বেশি শব্দদূষণ বাড়ছে। তাই অযথা কেউ হর্ন বাজালে আমরা সকলে নিজ নিজ জায়গা থেকে নিষেধ করি। এভাবেই একদিন দেশটা সুন্দর হয়ে উঠবে, positive, na, na, na
"জনগণের টাকা নষ্ট করে প্রচার করে লাভ কি, কাজ তো হয় না", negative, na, na, na
কখন, neutral, na, na, na
স্মার্ট কার্ড কবে আসবে, neutral, na, na, na
"সাহায্য চাইছি, আমার বাইকের দুই বছর দুই বছর মোট চার বছরের ট্যাক্স টোকেনের মেয়াদ শেষ, আমার জরিমানাসহ কত টাকা লাগবে বা একটি জন্য কত জরিমানা দিতে হবে", neutral, na, na, na
স্মার্ট কার্ড দেবে এখন, neutral, na, na, na
"এখন ডেলিভারি স্লিপ দিয়ে দুয়েকবার পানি খাই, পুলিশ বলে কি জানেন, স্লিপ দিয়ে গাড়ি চালানো যাবে না", negative, na, na, na
নাম পরিবর্তন করা যায় কি এখন, neutral, na, na, na
"আমাদের যাদের ১৩ তারিখ পরীক্ষা ছিল ড্রাইভিং লাইসেন্সের, সেটা কবে হবে জানেন?", neutral, na, na, na
"ভাই, নতুন গাড়ির রেজিস্ট্রেশন কবে চালু হবে?", neutral, na, na, na
সার্ভার ওপেন হবে কবে জেলা পর্যায়ে?, neutral, na, na, na
বিএসপি সার্ভার কি চালু হয়েছে?, neutral, na, na, na
"আসসালামু আলাইকুম, বিআরটিএর সকল কাজ কি এখন শুরু হয়েছে? কালকে কি এসে ড্রাইভিং লাইসেন্স এবং গাড়ির কাগজ করতে দিতে পারব? কেউ একটু তথ্য দিয়ে আমাকে সহায়তা করুন।", neutral, na, na, na
নাম পরিবর্তন করা যাবে?, neutral, na, na, na
এগুলো আরো আগেই করতে হতো।, negative, na, na, na
"ভাই, আমার লাইসেন্স তো হয়ে গেছে এখন আনা যাবে কি একটু জানাবেন।", neutral, na, na, na
ধন্যবাদ ভাই।, positive, na, na, na
"ভাই, এক বছর হয়ে গেছে নবায়ন করতে দিয়েছি এখনো পাইনি।", negative, na, slow, na
ভারী লাইসেন্স কার্যক্রম শুরু করা হোক।, neutral, na, na, na
টাকা খাওয়া কবে বন্ধ করবে?, negative, na, na, na
সার্ভার ওপেন হবে কবে?, neutral, na, na, na
নতুন গাড়ির রেজিস্ট্রেশন কবে থেকে শুরু হবে দয়া করে জানাবেন।, neutral, na, na, na
ড্রাইভিং লাইসেন্স সংক্রান্ত তথ্য কেউ দিতে পারবেন?, neutral, na, na, na
"ভাই, অনঅফিসিয়াল একটা বাইক রেজিস্ট্রেশন বিষয়ে কিছু পরামর্শ দিলে উপকৃত হতাম।", neutral, na, na, na
ইকুরিয়া বিআরটিএ নিয়ে কোনো আপডেট আছে?, neutral, na, na, na
"বাংলাদেশ বিআরটিএ দুর্নীতির বড় জায়গা, এই প্রতিষ্ঠানটি অনেক অলস, এখানে কর্মকর্তাদের পরিবর্তন করা হোক।", negative, na, na, na
সার্ভারটা চালু করা উচিত।, negative, na, slow, na
"ট্যাক্স টোকেনের মেয়াদ শেষ, মেয়াদ বাড়াতে পারব?", neutral, na, na, na
ইকুরিয়া কবে চালু হবে?, neutral, na, na, na
"তারা এখন কিছুই করছে না, শুধু একটা কাগজ ধরিয়ে দিচ্ছে।", negative, na, na, na
"কাগজ হারিয়ে গেছে, সেটা কি তোলা যাবে?", neutral, na, na, na
"বিআরটিএ বন্ধ রাখার কারণ কী? আগামী মাসের ৯ তারিখে আমার ফিঙ্গার ছিল, কী করা যায়?", neutral, na, na, na
দালালমুক্ত সেবা চালু করার জোর দাবি জানাচ্ছি।, positive, na, na, na
দিয়াবাড়ির খবর জানেন কেউ?, neutral, na, na, na
"গাড়ির কাগজের মেয়াদ কবে বাড়ানোর কার্যক্রম শুরু হবে সেটা একটু জানান, এবং ড্রাইভিং লাইসেন্সের পরীক্ষা কবে থেকে শুরু হবে?", neutral, na, na, na
"ট্যাক্স টোকেনের মেয়াদ শেষ, রিনিউ করা যাবে?", neutral, na, na, na
"ভাই, ট্যাক্স টোকেনের মেয়াদ শেষ, রিনিউ করা যায়?", neutral, na, na, na
যশোর বিআরটিএ নজরে আনা দরকার।, neutral, na, na, na
বড় দুর্নীতির জায়গা এটা।, negative, na, na, na
আমার ২১ জুলাই ফিঙ্গার পরীক্ষা ছিল।, neutral, na, na, na
গাড়ির ট্যাক্স টোকেন ও ফিটনেস মেয়াদ কি বাড়ানো হয়?, neutral, na, na, na
বনানী হেড অফিসে কাজ কি চলমান আছে কেউ কি বলতে পারেন ভাই?, neutral, na, na, na
