text,sentiment,eof,responsiveness,accuracy
"ডিজিটাল সিস্টেম হাসি, এখন স্মার্টভাবে বিকাশে টাকা নেয়", negative, na, na, na
বিস্ময়, neutral, na, na, na
আসলেই পাওয়া যায়?, neutral, na, na, na
এক বছর থেকে শুধু রেডি প্রিন্ট দেখাচ্ছে এটার জন্য কি করবো, negative, na, slow, na
একে আইনের আওতায় আনুন, negative, na, na, na
"আমি চার দিন ধরে সব কিছু জমা দিয়েছি এখনো আসেনি, কারণ কি", negative, na, slow, na
অনেক অনেক ধন্যবাদ আপনাদেরকে হাসি, positive, na, na, na
ফালতু কথা, negative, na, na, na
তিন বছর হয়েছে নবায়নের জন্য দিয়েছি এখনো কার্ড পাইনি আর আপনি বলছেন একদিনে কার্ড, negative, na, slow, na
"অনেক কোম্পানি আপনাদের ই-পেপার মানতে রাজি নয়, প্রেসেন্ট নিয়ে আসেন তখন চাকরি হবে। এ ক্ষেত্রে আপনারা কি করবেন?", neutral, na, na, na
আমাদের দেশে ড্রাইভিং লাইসেন্সের পরীক্ষা নেওয়ার সিস্টেম হাস্যকর। উন্নত দেশ দেখে এটা সংশোধন করুন। একজন চালককে ১০ বছর পর আবার কেন পরীক্ষা দিতে হবে?, negative, na, na, na
আর তিন মাস হলো এখনো পাইনি, negative, na, slow, na
নয় মাস হলো এখনো ড্রাইভিং লাইসেন্স পাইনি, negative, na, slow, na
পুরোপুরি মিথ্যা কথা, negative, na, na, na
ই-পেপার, neutral, na, na, na
"প্রতারকের কি করার দরকার, লাইনে দাঁড়িয়ে কষ্ট, একদিনে দেয়", negative, na, na, na
"স্যার আমারটা দশ মাস হয়েছে, আঙুল দিয়েছি, এখনো ড্রাইভিং লাইসেন্স পাইনি, নতুন করে এক বছরের সময় দিয়েছে", negative, na, slow, na
"মোটরসাইকেল কিনতে লাইসেন্স লাগে, আবার পরীক্ষা দিতে মোটরসাইকেল লাগে। এটা কেমন নিয়ম?", negative, na, na, na
"পাড়া থেকে বলছে দুই বছর হলো নবায়নের জন্য দিয়েছি, এখনো কার্ড পাইনি, তাজা মিথ্যা কথা বলছে রাগ", negative, na, slow, na
হৃদয় ভালোবাসা, positive, na, na, na
"কমেন্ট বক্স দেখে আমি শিহরিত, মিথ্যুক", negative, na, na, na
আমারটা বারো মাস হয়েছে এখনো স্মার্ট কার্ড পাইনি, negative, na, slow, na
"আমরা চাই নবায়নের সময় শুধু ফি জমা দিতে হবে, আবার নতুন খরচ না হয়", negative, high, na, na
সাত-আট মাস হয়ে গেছে এখনো নবায়নের কার্ড পাইনি, negative, na, slow, na
"একজন চালক প্রথমবার পরীক্ষা দিয়ে আঙুলের ছাপ দেয়ার পরে লাইসেন্স পায়, কিন্তু পাঁচ বছর পরে কেন আবার পরীক্ষা দিতে হবে? এটা বন্ধ করতে হবে", negative, na, slow, na
"আমি সিলেট থেকে বলছি, নবায়নের জন্য ১১ হাজার টাকা লাগে, সময় লাগে এক বছর। অল্প সময়ের মধ্যে পেতে চাই", negative, na, slow, na
"হ্যাঁ ভাই, আজকাল একদিনে সরকারও নেমে যায়, ভাবা যায়?", negative, na, na, na
তাহলে তো এখন কাজ চলছে, neutral, na, na, na
"এগুলো সব প্রতারণা, আমি আঙুল দিয়েছি রিসিভ পাইছি কিন্তু এখন নতুন করে টাকা জমা দিতে বলছে", negative, na, na, na
"আমি পাঁচ বছর ধরে লাইসেন্স পাইনি, আগেই টাকা নিয়েছে আর বলেছে একদিনে দিবে", negative, na, slow, na
"দেড় বছর হয়েছে, আবার বলে একদিনে", negative, na, slow, na
২০২১ থেকে মজা নিচ্ছে, negative, na, na, na
"বিদেশ যেতে পারছি না, স্মার্ট কার্ডের জন্য তিন মাস হলো, উনি তো শুধু বক্তব্য দিচ্ছেন", negative, na, slow, na
"তিন বছর হয়ে গেল, টাঙ্গাইলে বলে সার্ভারের সমস্যা", negative, na, slow, na
"লজ্জা কি ভুলে গেছে, মানুষ দুই বছরেও পায়নি", negative, na, slow, na
অসভ্য, negative, na, na, na
এসব চোর মিথ্যা বলে বুকও কাঁপে না, negative, na, na, na
তোর বাবার মাথা, negative, na, na, na
নন প্রফেশনাল থেকে প্রফেশনাল করার প্রক্রিয়া কবে চালু হবে? আমরা ভোগান্তিতে আছি, negative, na, na, na
"কাজ হয় না কিছু, পুলিশ শোনে না", negative, na, na, na
হাসি হাসি হাসি, neutral, na, na, na
অর্থহীন, neutral, na, na, na
"ভাই, কথা লাইসেন্স তিন-চার মাস হলো পাইনি, সমস্যা কি?", negative, na, slow, na
"সব বাজে কথা, নয় মাস হলো দিয়েছি এখনো পাইনি", negative, na, slow, na
"কালকে সংশোধনের জন্য আবেদন করে টাকা জমা দিয়েছি, দেখা যাক একদিনে পাই কিনা", neutral, na, na, na
"এক বছর আগে দিয়েছি, এখনো পাইনি, আর আপনি বলছেন একদিনে পাওয়া যায়। কত মিথ্যা কথা বলবেন", negative, na, slow, na
"ধুর মিয়া, নবায়নের জন্য তিন বছর হয়েছে, এখনো পাইনি", negative, na, slow, na
আমারটা দুই দিনেই পেয়েছি, positive, high, fast, na
"মিথ্যা কথা, আমি ২০২৩ সেপ্টেম্বরে আবেদন করেছি অনলাইনে, এখন জুন ২০২৪, হাতে পাইনি", negative, na, slow, na
বেকার কার্ডের টাকা নেন কেন, negative, na, na, na
আমরা স্মার্ট কার্ডের জন্য বাইরে যেতে পারছি না, negative, na, na, na
"১৯ মার্চ ২০২৪ ডেলিভারি ডেট ছিল, এখনো পাইনি, শুধু বলে আসবে", negative, na, slow, na
তিন বছর ধরে শুধু রেডি প্রিন্ট লেখা আসছে, negative, na, slow, na
"ঘুষ দিলে সম্ভব, না হলে বছরের পর বছর ঘুরতে হবে", negative, na, slow, na
"এটা নিউজে না বলে পুলিশকে বলেন, আমাকে ধরে লাইসেন্স কপি দেখালাম বলে স্মার্ট কার্ড ছাড়া হবে না", negative, na, na, na
"নাটক, চার হাজার টাকা ফিক্স রেট করে রেখেছে, ঘুষের টাকা, ফেল করায়", negative, na, na, na
স্মার্ট কার্ড যদি না লাগে তাহলে টাকা নিচ্ছেন কেন, negative, na, na, na
"এমন চেয়ারম্যান থাকলে কোনোদিন লাইসেন্স পাব না। উনি চেয়ারে বসে বলে দিলেন একদিনে পাওয়া যায়, কিন্তু দুই বছরেও পাইনি", negative, na, slow, na
"আমার ভাই তিন-চার মাস হয়ে গেছে, কোনো খবর নাই", negative, na, slow, na
মিথ্যা কথা বলারও একটা সীমা থাকে, negative, na, na, na
দেড় বছর হয়ে গেল এখনো ড্রাইভিং কার্ড পাইনি, negative, na, slow, na
"ভুয়া কথা, অনেক ঝামেলা। লার্নার করতে আবেদন করেছি, পরীক্ষা তিন মাস পরে, অফিসার নেই বলে স্থগিত। তাহলে কিভাবে একদিনে লাইসেন্স পাব?", negative, low, slow, na
"দয়া করে স্মার্ট কার্ড দ্রুত দিন, ধন্যবাদ", positive, na, na, na
হাসি মরিচ রাগ, neutral, na, na, na
"কার্ড কই? লাইসেন্স কেন দিবেন না? কার্ডের জন্য টাকা নেবেন, লাইসেন্স দিবেন না, প্রতারণা বাদ দিন", negative, na, na, na
"সব মিথ্যা, মগজ ধোলাই করছে", negative, na, na, na
সব মিথ্যা কথা, negative, na, na, na
"প্রদেয় কিন্তু কোনো খবর নাই, খুব খারাপ", negative, na, slow, na
২২ সালে পাওয়ার কথা ছিল এখনো হাতে পাইনি, negative, na, slow, na
"স্যার, আমার ছয় মাস হলো আঙুল দিয়েছি, এখনো লাইসেন্স পাচ্ছি না", negative, na, slow, na
"স্যার, ছয় মাস হলো আঙুল দিয়েছি, এখনো কার্ড পাচ্ছি না", negative, na, slow, na
"আমার তিন বছর হয়ে গেছে, এখনো স্মার্ট কার্ড পাইনি", negative, na, slow, na
"মিথ্যা কথা বলে বড় চেয়ারে বসা যায়, কিন্তু মরার পর হবে না", negative, na, na, na
"ই-ড্রাইভিং লাইসেন্স পেয়েছি মাত্র ২০ দিনে, এখন স্মার্ট কার্ড কবে পাবো?", positive, high, fast, na
"দুর্বৃত্ত, বিদেশে ৩০-৪০ মিনিটে ফলাফল, এখানে শুধু টাকা দিলেই হবে", negative, high, fast, na
"আমার লাইসেন্সের ই-কপি গত বছর ডিসেম্বরে এসেছে। বিদেশ যেতে জানুয়ারিতে জরুরি আবেদন করেছি, মে মাসেও স্মার্ট কার্ড পাইনি। বিদেশে অনেক সমস্যায় আছি। এখন দ্রুত কিভাবে মূল লাইসেন্স পাবো?", negative, na, slow, na
আজ ছয় বছর হয়ে গেল লাইসেন্স পাইনি। আর চেয়ারম্যান বলছে একদিনেই পাওয়া যায়। এটাই মনের দুঃখ, negative, na, slow, na
মিথ্যা কথা বলিয়ে না হাসি, negative, na, na, na
আমি এগারো মাস পরে পেয়েছি, positive, high, slow, na
আমার দুই বছর হয়ে গেছে এখনো পাইনি, negative, na, slow, na
"আমার এক বছর তিন মাস হয়ে গেছে, এখনো পাইনি, আমি কুয়েতে আছি, কেউ সাহায্য করলে কৃতজ্ঞ থাকবো কান্না", negative, na, slow, na
"সব ঠিক আছে কিন্তু অফিস থেকে দালাল বের করে দিন, তাদের কারণে অনেক ভোগান্তি হচ্ছে", negative, na, na, na
কোথায় পাওয়া যায় একদিনে? আমি করতে চাই সেখানে হাসি, neutral, na, na, na
ভুয়া, negative, na, na, na
"লার্নার পরীক্ষায় পাশ করার পর কতদিনের মধ্যে ফাইলের টাকা দিতে হয়? আমি দিইনি, এক বছরের বেশি হয়ে গেছে", neutral, na, na, na
নাটোরে পাই না, negative, na, na, na
স্যার আমার লাইসেন্স দুই বছর ধরে পাইনি, negative, na, slow, na
"সাত দিন হয়েছে এখনো পাইনি, কিভাবে একদিনে পাবে?", negative, na, slow, na
"আমাদের থেকে যে ৪৬০০ টাকা ফি নেয়া হয়, সেটা কি করে? পরীক্ষায় পাশ করার পর এক বছরেও হার্ড কপি পাওয়া যায় না", negative, na, slow, na
এদের কিভাবে চাকরি দেয় বোঝা যায় না, negative, na, na, na
"মনে হয় আলু সেদ্ধ করল, সব নষ্ট করে দিল। কাগজ হারিয়ে লাইসেন্স বাতিল হয়ে গেল", negative, na, na, na
"দুই বছর প্রায় শেষ, এখনো পাইনি", negative, na, slow, na
গালি দিব নাকি?, negative, na, na, na
"এখনো পাইনি, তিন মাস পার হয়ে গেছে", negative, na, slow, na
"আমার পাঁচ মাস হয়ে গেল, এখনো স্মার্ট কার্ড পাইনি", negative, na, slow, na
হার্ড কপি দেবেন না তাহলে টাকা নেন কেন, negative, na, na, na
"হাসি অফিসে গেলে এক কথা, সংবাদ সম্মেলনে আরেক কথা", negative, na, na, na
"সম্পূর্ণ মিথ্যা, একদিনে কখনো সম্ভব না। আজ ২২ দিন হয়ে গেছে, অনলাইন কপি পাইনি রাগ", negative, na, slow, na
"আমি আঙুল দিয়েছি পাঁচ মাস আগে, এখনো কিছু পাইনি, আর বলে একদিনে দিবে হাসি", negative, na, slow, na
এক সপ্তাহ হয়ে গেছে এখনো ই-লাইসেন্স পাইনি, negative, na, slow, na
"গত ২৫ তারিখে পরীক্ষা দিয়ে এসেছি, এখনো মেসেজ আসেনি। সব কিছু বৈধভাবে করেছি, বৈধ করলে তারা কাজই করে না", negative, na, slow, na
আমি চার মাসেও পাইনি, negative, na, slow, na
"কালকে পরীক্ষা দিলাম কিন্তু রেজাল্টের মেসেজ আসেনি, সোনার বাংলাদেশ হাসি", negative, na, slow, na
২ বছর হয়ে গেছে এখনো পাইনি, negative, na, slow, na
তোদের মিথ্যা কথায় দুনিয়া গরম হয়ে গেছে আমি গত এক বছর অপেক্ষা করছি, negative, na, slow, na
৫ মাস হয়ে গেছে এখনো পাইনি, negative, na, slow, na
"কি প্রতারণার কথা হাসি নয় মাস হয়ে গেছে, কার্ড এখনো পাইনি, বাংলাদেশ ডিজিটাল হয়ে গেছে বিরক্ত হাসি", negative, na, slow, na
এটা কে? অবাস্তব কথা বলছে। বাস্তবতা সম্পর্কে তার কোনো ধারণা নাই, negative, na, na, na
"আপনার কথা শুনে মনে হচ্ছে বিআরটিএ তারা নিজেরাই চালায়। দুই বছর হলো লাইসেন্সের কাজ চলছে, লাইসেন্স হারিয়েছি, এখনো পাইনি। পাঁচ হাজার টাকা খরচ হয়েছে। আপনাদের জন্য আমাদের জীবনের ক্ষতি হয়েছে।", negative, low, slow, na
"পুরো মিথ্যা কথা, তিন বছর ধরে বসে আছি, লাইসেন্স পাইনি, তারা গাঁজা খেয়ে কথা বলে", negative, na, slow, na
২০২৩ সালের ১৬ জানুয়ারি আঙুল দিয়েছি এখনো পাইনি, negative, na, slow, na
আবেদন অনুমোদন হতেই ১৫ দিন সময় লাগে, neutral, na, moderate, na
হিরোর মতো বড়াই কথা, negative, na, na, na
"৪ মাস হলো প্রিন্টিং এ আছে, কার্ড পেলাম না", negative, na, slow, na
উপহার ছাড়া কাজ হয় না হাসি, negative, na, na, na
আপনার স্যার রা হার্ড কপি ছাড়া চাকরি দেয় না, negative, na, na, na
হাসি, neutral, na, na, na
তোদের কারণে প্রবাসে যেতে পারছে না হাজারো চালক কান্না, negative, na, slow, na
"টাকা নিচ্ছেন স্মার্ট কার্ডে, ই-পেপার দিচ্ছেন কেন", negative, na, na, na
"কি বলেন আপনি, আমি লাইসেন্সের জন্য এক বছর আগে দিয়েছি এখনো পাইনি", negative, na, slow, na
"নিউজটা না দেখলে ভুলেই যেতাম, আমিও লাইসেন্স করতে দিয়েছি হাসি", negative, na, na, na
মিথ্যা কথা বলছে হাসি, negative, na, na, na
হাসি, neutral, na, na, na
হাসি, neutral, na, na, na
৩ মাস হয়ে গেছে এখনো স্মার্ট কার্ড পাইনি, negative, na, slow, na
"চোরের বাচ্চারা শুধু মিথ্যা কথা বলে, আমার ছোট ভাই বিদেশ যাবে, তিন মাস ধরে ঘুরছে, এখনো লাইসেন্স পাইনি কান্না। ভিসার মেয়াদ শেষ হয়ে যাচ্ছে। অনেক টাকা ধার নিয়ে ভিসা কিনেছি। কেউ কি সাহায্য করবেন প্রার্থনা", negative, na, slow, na
"সে পাগল হয়েছে, তার বাড়িতে জানে না", negative, na, na, na
ভালো, positive, na, na, na
"প্রতারকের বাচ্চা, আঙুল দিয়ে ১০ মাস ধরে ঘুরছি", negative, na, slow, na
১ বছর হলো এখনো বার্তা আসেনি, negative, na, slow, na
ধন্যবাদ, positive, na, na, na
"এই মাসের ৪ তারিখে পরীক্ষা শেষ করেছি, এখনো ই-টোকেন পাইনি", negative, na, slow, na
"১৩ মাস আগে আঙুল দিয়েছি, কার্ড দিচ্ছে না। নতুনদের এক মাসে হলেও পুরানদের কোনো নিশ্চয়তা নেই। হাজার হাজার মানুষ ভুগছে", negative, na, slow, na
"আমি গতকাল লাইসেন্স সংশোধনের আবেদন করেছিলাম, আজ একদিনেই ই-লাইসেন্স পেয়েছি, ঘটনা সত্যি", positive, high, fast, high
"১৮ মাস শেষ, কার্ড পাইনি। আর ই-লাইসেন্স দিয়ে চাকরি দিবে কি? হাসি", negative, na, slow, na
"কমেন্টগুলো পড়ুন। আপনার অফিসের কি বেহাল দশা জানেন? টাকা ছাড়া হয় না। আমি ভালোভাবে পরীক্ষা দিলেও পাশ করিনি, কিন্তু অশিক্ষিত একজন টাকা দিয়ে পাশ হয়েছে", negative, low, slow, low
২ বছর পার হয়েছে, negative, na, slow, na
সব মিথ্যা কথা, negative, na, na, na
"আমার ২০১৯ এ কাগজ করেছি, স্মার্ট কার্ড এখনো পাইনি। ২০২২ সালে অফিসে গেলে সময় বাড়িয়ে দিলো। কার্ড কবে পাবো আল্লাহ জানে", negative, na, slow, na
মিথ্যা কথা, negative, na, na, na
"বিআরটিএ অফিসে পরীক্ষা দিয়ে পাশ করার পরও অকৃতকার্য দেখালো, টাকা ছাড়া কাজ হয় না", negative, na, na, low
"অনলাইনে আবেদন করেছি, তিন মাস হলো ই-লাইসেন্স উঠেছে, কিন্তু স্মার্ট কার্ড পাইনি। বাংলাদেশে দুর্নীতি কমবে না, বাড়বে", negative, na, slow, na
৬ মাস হয়ে গেছে এখনো পাইনি, negative, na, slow, na
মদ্যপ!, negative, na, na, na
পাঁচ বছর ধরে শুনছি একদিনে লাইসেন্স পাওয়া যায়। আজ পর্যন্ত পাইনি। যা দিয়েছে তা দিয়ে চাকরি হয় না, negative, na, slow, na
"আমার নবায়নকৃত লাইসেন্স তিন বছরের বেশি হয়েছে, এখনো হাতে পাইনি", negative, na, slow, na
"৭ মাস হলো সংশোধন করেছি, কার্ড পাইনি, নবায়ন করতে পারছি না", negative, na, slow, na
মনে হয় না, negative, na, na, na
"পুরনো পাগলে ভাত পায় না, নতুন পাগলের আমদানী। চাপাবাজি কমান। কেন ২৫০০ টাকা নিয়েছেন শুধু এক টুকরো কাগজের জন্য? ডলার সংকটের অজুহাত দেবেন না", negative, na, na, na
বাস্তবে এটা হলে ভালো, positive, na, na, na
"আমি দেশের বাইরে যাবো, স্মার্ট কার্ড দরকার। ৬ মাস হলো লাইসেন্স করেছি, এখনো স্মার্ট কার্ড পাইনি", negative, na, slow, na
লাইসেন্স বাতিলের অপশন বন্ধ কেন? সব বিষয়ে কাজ করা উচিত, negative, na, na, na
"২০১৮ সালের ভুক্তভোগী আমি, এখনো স্মার্ট কার্ড পাইনি। যদি সত্যিই আপডেট হয়ে থাকে তবে আমি কার্ড পাবো আশা করি", negative, na, slow, na
দুই বছর অপেক্ষা করছি এখনো লাইসেন্স পাইনি, negative, na, slow, na
