text,sentiment,eof,responsiveness,accuracy
"টেলিটক আমাদের সাথে নতুন করে প্রতারনা করতেছে গত স্বৈরাচারী সরকারের মতো, ঠান্ডা মাথায়!", negative, na, na, low
"অন্য সিমের মত করা উচিৎ, সিম একটা থাকবে, যখন তখন ইচ্ছে মত প্যাকেজ পরিবর্তন করতে পারবে।", neutral, moderate, na, na
"নেটওয়ার্কই তো নাই, এত রঙ্গের সিম দিয়ে কি করবে!", negative, na, slow, na
আশা করি অতিরিক্ত সিম কেনার কোনো দরকার নাই।, neutral, low, na, na
ঠিক, neutral, na, na, na
হ্যাঁ, neutral, na, na, na
ঠিক, neutral, na, na, na
সত্য, neutral, na, na, na
এই সিমের নেটে কাজ করে না, negative, na, slow, na
এটা শুধু বাংলাদেশে সম্ভব নেট সেবার উন্নতির কোন খবর নাই শুধু সিমের প্রকারভেদ আর প্রকারভেদ।, negative, na, slow, na
স্বাগতম বাদ পড়েছে, neutral, na, na, na
আর কোনো কোম্পানির সিমে এতো বাজে নেটওয়ার্ক সেবাও নাই ভুল করে যেনো কেউ টেলিটক না কিনে, negative, na, slow, na
অনলাইনে ফেসবুক থেকে বিজ্ঞাপন দেখে এসএমএসে ফলাফল দেখব। স্বপ্ন ভাই স্বপ্ন, negative, low, na, na
২২ ঘন্টা জরুরি থাকে, negative, na, slow, na
চমৎকার তথ্য, positive, na, na, high
দেশে অনেক কিছু পরিবর্তন হয়ে গেল কিন্তু আপনাদের নেটওয়ার্কের কোনো পরিবর্তন নাই। কিন্তু কল রেটটা ভালো কিন্তু ডেটা কিনে চিন্তায় থাকি এগুলো ব্যবহার করতে পারব কিনা। এবার একটু নেটওয়ার্কটা ঠিক করুন।, negative, na, slow, na
আমি কিভাবে নিব আমি তো মাদ্রাসার শিক্ষার্থী, neutral, low, na, na
কুমিল্লা বোর্ডের পুনঃনিরীক্ষণের মেসেজ বারবার ভুল আসছে কেনো? একটু পরীক্ষা করুন।, negative, moderate, slow, low
বিদ্যুৎ চলে গেলে কোন নেটওয়ার্ক পাওয়া যায় না।, negative, na, slow, low
টেলিটক পাশে থাকার জন্য ধন্যবাদ।, positive, na, na, na
যদি আমি ইংরেজির পুনঃনিরীক্ষণের জন্য আবেদন করি তাহলে কী প্রথম ও দ্বিতীয় পত্র মিলে ৩০০ টাকা লাগবে নাকি ১৫০ টাকা লাগবে, neutral, low, na, na
"বিদ্যুৎ চলে যাওয়ার সাথে সাথে নেট থাকে না, সমাধান করুন তাড়াতাড়ি?", negative, na, slow, low
বিদ্যুৎ নাই টেলিটক নেটওয়ার্কও নাই, negative, na, slow, low
চমৎকার তথ্য, positive, na, na, high
"যেসকল দোকানে টেলিটক সিম বিক্রি করে, সেখান থেকে কী জেন জি সিম ক্রয় করা যাবে", neutral, low, na, na
"বিদ্যুৎ চলে গেলে নেট থাকেনা, এটির সমাধান করা জরুরী", negative, na, slow, low
ধন্যবাদ সুন্দর করে বুঝিয়ে দেওয়ার জন্য, positive, high, na, na
"আমাদের এলাকা, নরসিংদী জেলার, শিবপুর থানা, পুটিয়া ইউনিয়ন, সালুরদিয়া গ্রাম, বিদ্যুৎ চলে গেলে আর নেটওয়ার্ক পাওয়া যায় না।", negative, na, slow, low
ধন্যবাদ, positive, na, na, na
আপনাদের সেবার মান বাড়ান। একটা সরকারি প্রতিষ্ঠানের সেবার মান এতো বাজে হয় কিভাবে? নেটওয়ার্ক সক্ষমতা বাড়ান। ইনশাআল্লাহ আপনারাই তরুণদের প্রথম পছন্দ থাকবেন, positive, na, na, na
আমাদের এলাকায় টেলিটক নেটওয়ার্কের খুবই বাজে অবস্থা আমার বাসার পাশেই বাংলালিংক টাওয়ার আমার সিমে রোমিং সেবাটি দেওয়ার জন্য বিনীত অনুরোধ করছি।, negative, na, slow, na
এক মেসেজে কী একাধিক বিষয়ের আবেদন করা যাবে? প্রক্রিয়া কী এবং ফি কত?, neutral, moderate, na, na
"ধন্যবাদ টেলিটক, পাশে আছি ২০২০ থেকে", positive, na, na, na
"অনেক আশা নিয়ে টেলিটক সিম কিনেছি, তবে নেটওয়ার্কের বাজে অবস্থা। বিদ্যুৎ না থাকলে নেট বন্ধ।", negative, na, slow, low
নেটওয়ার্ক ব্যবস্থা ভালো করুন, negative, na, na, na
"শুক্রবারে কোড ডায়াল করলে জিবি আসে নাই, আপনাদের ইনবক্সে মেসেজ করে ১ দিন পরে উত্তর পেয়েছি, বাজে সেবা", negative, low, slow, low
"জেন-জি সিমে ৪জি নেটওয়ার্ক পাই না। একদমই পাচ্ছি না। জেন-জি ছাড়া অন্য একটা সিম ব্যবহার করলে ৪জি আসে, জেন-জি তে আসে না কেন?", negative, na, slow, na
আজ দুই দিন ধরে ফোনে নেটওয়ার্ক পাচ্ছে না মেসেজ কিভাবে দিব। নিজেদের নেটওয়ার্ক একটু ঠিক করুন, negative, na, slow, na
সবার জন্য শুভকামনা, positive, na, na, na
আমার একটা টেলিটকের সিম প্রয়োজন! আমি কিভাবে আবেদন করতে পারি বা কোথা থেকে কিনতে পারি?, neutral, low, na, na
সুসংবাদ, positive, na, na, na
সবার জন্য শুভকামনা রইল।, positive, na, na, na
এমএনপি করতে কয় টাকা লাগবে?, neutral, low, na, na
নেটই তো নাই, negative, na, slow, na
অ্যাপস থেকে কী পুনঃনিরীক্ষণ আবেদন করা যাবে?, neutral, moderate, na, na
ধন্যবাদ, positive, na, na, na
আলহামদুলিল্লাহ এ+, positive, na, na, na
আলহামদুলিল্লাহ, positive, na, na, na
অভিনন্দন, positive, na, na, na
ধন্যবাদ, positive, na, na, na
অন্য প্যাকেজ থেকে কি জেন জি প্যাকেজে যাওয়া যাবে, neutral, moderate, na, na
এই ধরনের তথ্য সবাই দিতে পারে স্বীকার করুন যে আপনারা ভালো সেবা দিতে পারেন না, negative, na, na, low
এখানে আবেদন করতে হবে।, neutral, low, na, na
ফলাফল বের হওয়ার ছয় ঘন্টা পর আপনাদের নজরে আসলো, negative, na, slow, na
"নেটওয়ার্ক থাকে না, ‘নো সার্ভিস’ সবসময়, মাঝে মাঝে একটু পায়", negative, na, slow, na
"নেটওয়ার্কের মান উন্নত করুন, তারপর সবাই ব্যবহার করবে", positive, na, na, na
"এই সিস্টেমটা পুরোনো হয়ে গেল, মাইটেলিটক অ্যাপস থেকে কীভাবে করা যাবে?", negative, moderate, na, na
অ্যাপ স্টোরে জেন-জি অফার সহ হালনাগাদ কবে দিবেন?, neutral, moderate, na, na
জেন জি সিম পাবো কিভাবে?, neutral, low, na, na
"টেলিটকের সাথে আছি সেই ২০১৩ থেকে। শুধু দুঃখের বিষয় সেবা ভালো না। রিচার্জ, সিম পরিবর্তন, ভালো মতো নেট ইত্যাদি পাওয়া যায় না।", negative, low, slow, na
"টেলিটকের তো কথা বলারও নেট পায় না, সরকারি অপারেটর বলতে লজ্জা লাগে", negative, na, slow, na
"আমি পুনঃনিরীক্ষণের জন্য বোর্ডে মেসেজ পাঠাচ্ছি কিন্তু যাচ্ছে না, কি সমস্যা দেখবেন", negative, moderate, slow, low
নরসিংদীর রায়পুরায় নেট অনেক কম থাকে কেন? দ্রুত ব্যবস্থা নেয়ার জন্য অনুরোধ করছি। খুবই বাজে অবস্থা।, negative, na, slow, na
এসএমএসে কত টাকা করে চার্জ কাটবে?, neutral, na, na, na
খুব ভালো, positive, na, na, na
বিদ্যুৎ নাই নেটওয়ার্ক নাই তাকেই বলে টেলিটক, negative, na, slow, low
আমাদের এখানে নেটওয়ার্ক নেই, negative, na, slow, na
আপনাদের যে নেট চলে না, negative, na, slow, na
এসএমএস চার্জ কত?, neutral, na, na, na
আপনাদের নেটওয়ার্ক তো ভালো না আর ১২১ ফোন করলে সেবা পাই না, negative, low, slow, low
সবার জন্য শুভকামনা, positive, na, na, na
নেটওয়ার্ক ও নেটের অবস্থার উন্নতি নাই কেন? নাহিদ ইসলাম দেখুন!, negative, na, slow, na
টেলিটকের ঘুম ভেঙেছে?, negative, na, na, na
মার্কশিট সহ আসবে?, neutral, na, na, na
আগে নেটওয়ার্কিং ব্যবস্থার উন্নতি করুন।, neutral, na, na, na
আমি একটা ছাত্র সিম নিতে চাই, neutral, low, na, na
বাসার ভিতরে নেটওয়ার্কই থাকে না কোন, negative, na, slow, na
নওগাঁয় টেলিটকের অফিস কোথায়?, neutral, na, na, na
ময়মনসিংহ জেলার নান্দাইল থানায় আপনাদের নেটওয়ার্ক পাওয়া যায় না। তাহলে কিভাবে দেখব?, negative, na, slow, na
"বিদ্যুৎ চলে যাবার পর নেটওয়ার্ক ও ইন্টারনেট পাচ্ছি না। এলাকা থানা ডামুড্যা, জেলা শরীয়াতপুর।", negative, na, slow, low
জেন জি এর দাম কত, neutral, na, na, na
টেলিটকের বিচরণ হওয়া দরকার সর্বত্র। আমি জানি আপনারা উত্তর দিবেন। এই উত্তরের লোক কমিয়ে নেটওয়ার্ক এর উন্নতির খাতে সেই টাকা লাগান। জনগণ শান্তি পাক। তখন আর আপনাদের ফেসবুকে পোস্ট আর উত্তর দেয়ার দরকার হবে না।, positive, low, na, na
আমি একটা বর্ণমালা সিম নিতে চাই কিভাবে নিব, neutral, low, na, na
ভাইয়া এমন নেট বিদ্যুৎ একটু না থাকলেই নেটওয়ার্ক যায়, negative, na, slow, low
আচ্ছা টেলিটক নতুন সিমের দাম কত, neutral, na, na, na
ঘরের ভেতর কোন নেটওয়ার্ক থাকে না। লোকেশন জেলা:শেরপুর উপজেলা:শ্রীবরদী, negative, na, slow, na
চার্জ কাটে কতো?, neutral, na, na, na
টাওয়ার নেটওয়ার্ক এতো ধীর কেন।, negative, na, slow, na
"নেটওয়ার্ক নিয়ে কাজ করা উচিত, গ্রামে খুবই বাজে অবস্থা", negative, na, slow, na
"প্রিয় গ্রাহক, দেশের বিভিন্ন অঞ্চলে নেটওয়ার্ক সম্প্রসারণের কাজ চলছে। আশা করি খুব শীঘ্রই নেটওয়ার্ক জনিত সমস্যা সমাধান হয়ে যাবে। টেলিটকের সাথে থাকার জন্য অসংখ্য ধন্যবাদ। এই সংলাপ আর কত চলবে", negative, low, slow, na
আপনাদের টেলিটকে তো শুধু সিম থেকে সিম কথা বলা ছাড়া আর কিছু হয় না। ইন্টারনেট ব্যবহার করার কথা ভাবাও পাপ হয়। সরকারের টাকা নিয়ে আপনারা যে দুর্নীতি করছেন এটা ঠিক না। আমরা কিন্তু অতি শীঘ্রই আপনাদের অফিসে হানা দিতে বাধ্য হব।, negative, na, slow, na
আলহামদুলিল্লাহ এ+, positive, na, na, na
বিদ্যুৎ চলে গেলে নেটওয়ার্ক চলে যায় কেনো? লোকেশন: শেরপুর সদর।, negative, na, slow, low
সিম কিভাবে ব্যবহার করবো? নেটওয়ার্ক কাভারেজই নাই, negative, na, slow, na
ভাই আপনাদের নেটওয়ার্ক কবে ভালো হবে।, negative, na, na, na
ফটিকছড়ি ভূজপুর থানায় তো অকটেন দিলেও আপনাদের নেট পাওয়া যায় না, negative, na, slow, na
এমবি কিনেছি এখনো ব্যবহার করতে পারলাম না। কোন এলাকা শুনতে চেয়ে আর অপমানিত হবেন না।, negative, na, slow, low
জেন-জি সিম কিভাবে কিনবো?, neutral, low, na, na
কিশোরগঞ্জ জেলার করিমগঞ্জ উপজেলার পৌর এলাকায় আপনাদের নেটওয়ার্ক কবে চালু হতে পারে?, neutral, na, na, na
পদার্থ ১ম এবং ২য় এটার জন্য কী আলাদা আলাদা করে বোর্ড চ্যালেঞ্জের মেসেজ দিতে হবে? এবং কত দিন পরে ফলাফলটা দিবে?, neutral, moderate, na, na
টেলিটক সিমের গ্রাহক চাহিদা অনেক বেশি। তবে নেটওয়ার্কের গতি খুবই কম।, negative, na, slow, na
একের অধিক বিষয় পুনঃনিরীক্ষার জন্য আবেদন করতে হলে কিভাবে করব জানাবেন প্লিজ, neutral, moderate, na, na
নতুন সিম কিভাবে কিনবো?, neutral, low, na, na
রাজবাড়ী শহরে দুপুর ১:৩০ থেকে নেটওয়ার্ক নেই।, negative, na, slow, na
"প্রিয় গ্রাহক, আপনার অফারটি সফলভাবে সাবস্ক্রাইব করা হয়েছে। আপনার ব্যালান্স থেকে ১৩ টাকা কেটে নেওয়া হয়েছে। টেলিটক। এই প্যাকেজটি কি ধরনের কাজে ব্যবহার করার জন্যে? যদি জানাতেন।", neutral, na, na, na
চট্টগ্রামে কি কেয়ামতের আগ পর্যন্ত ৪জি চালু হবে?, negative, na, slow, na
এখন সিমের দাম কত?, neutral, low, na, na
২০২৪ সালের এইচএসসি পরীক্ষার্থীদের জন্য রইল শুভ কামনা, positive, na, na, na
"উদ্বোধন না, প্রকাশ?", neutral, na, na, na
এখানে ফেল করা মেয়ে বিয়ে করা হয়, neutral, na, na, na
"সিম কিনে নেটওয়ার্কের অভাবে যদি ফেলেই রাখতে হয়, তাহলে কি লাভ হলো আপনাদের সিম কিনে?", negative, na, slow, na
আপনাদের কাস্টমার কেয়ার কয়টা থেকে কয়টা চালু থাকে?, neutral, na, na, na
"সবাই তো এটাই চাই দেশের টাকা দেশে থাকুক কিন্তু আপনাদেরই সদিচ্ছা নাই। আপনাদের টাওয়ারই খুঁজে পাই না, সিম কিনব তামাশা করার জন্য", negative, na, slow, na
"খালি গল্প, ঢাকা শহরেই তো নড়বড়ে অবস্থা", negative, na, slow, na
"নেটওয়ার্কের যে অবস্থা, বিদ্যুৎ চলে গেলে আর নেটওয়ার্ক থাকে না", negative, na, slow, low
নেটওয়ার্ক সমস্যা সমাধান করে, neutral, na, na, na
আমার টেলিটক সিমে ১ দাগের বেশি পাইনা। ৪জি মানে কি ১ দাগ?, negative, na, slow, na
কিন্তু নেটওয়ার্ক কই, negative, na, slow, na
বিদ্যুৎ চলে গেলে তো নেটওয়ার্ক থাকেনা, negative, na, slow, low
শঠিবাড়িতে ৪জি চাই শঠিবাড়ি মিঠাপুকুর রংপুর, neutral, na, na, na
"৩ বছর ধরে টেলিটক সিম চালাচ্ছি, কিন্তু গত কয়েক মাস ধরে অবস্থা অবনতির দিকেই যাচ্ছে। কথা পর্যন্ত বলা যাচ্ছে না", negative, na, slow, na
ভোল্টি সেবা চালু করুন, neutral, na, na, na
৪জি এলাকার তালিকা দিন, neutral, na, na, na
আমাদের ২জি টা দিন, negative, na, slow, na
ভোলা বোরহানউদ্দিন থানা এলাকা ৩জি রয়ে গেলো কখনো ৪জি দেখা পাবো না?, negative, na, slow, na
ফুলগাজী ফেনী ৪জি আছে কি?, neutral, na, na, na
"মুন্সিগঞ্জ, গজারিয়া তে কি ৪জি আছে বা পাওয়া যাবে?", neutral, na, na, na
আমার এলাকায় নেটওয়ার্ক কই? নেটওয়ার্ক না থাকলে সিম কিনে কি করবো?, negative, na, slow, na
"বুড়িমারী, পাটগ্রামে লাগান", neutral, na, na, na
নোয়াখালী কোম্পানিগঞ্জ উপজেলাতে কোন টাওয়ার নেই টেলিটকের?, negative, na, na, na
আমার বর্তমান ঠিকানায় কলিং এ ভালোমতো কথা বলা যায় না! আগে এটাই ঠিক করুন, negative, na, slow, na
কক্সবাজার ঈদগাঁও উপজেলায় কোন ৪জি নেটওয়ার্ক নাই।, negative, na, slow, na
আগে ৩জি নেট প্রাপ্তি নিশ্চিত করুন।, negative, na, na, na
আপনাদের নেটওয়ার্ক বাজে।, negative, na, slow, na
আপনাদের লজ্জা নাই। মিথ্যা কথা বলেন। গতি যেদিন ভাল দিবেন সেদিন এসব পোস্ট করবেন। নামের ৩জি ৪জি।, negative, na, slow, low
"৪জি ১০০% করছেন ঠিক আছে কিন্তু ঘরের ভিতর ‘নো সার্ভিস’ আসে কেনো, আপনারা কোথায় ১০০% ৪জি কভারেজ দিলেন, প্রতারণার একটা সীমা থাকে, বর্তমান সরকার যেমন আপনারাও তেমন", negative, na, slow, low
"আগে যেখানে নেট চালু করেছেন, সেখানে গতি বাড়িয়ে দিন", negative, na, na, na
পৌর এক এলাকায় সরকারি অফিসের সাথে আমার বাসার ভিতরে বেশিরভাগ ‘নো নেটওয়ার্ক’ বা ‘ই’, negative, na, slow, na
টেলিটক আগে রংপুরের সিটি কর্পোরেশন এলাকাগুলোতে দিতে পারেন কিনা দেখুন। এমন নেট আপনাদের রংপুরের ২ নং ওয়ার্ডে থেকেও মনে হয় জঙ্গলে বাস করছি।, negative, na, slow, na
কোন দোকানে তো রিচার্জ নাই, negative, low, na, na
২টা আছে আগে নেট ভালো করুন আরো ২টা নিবো, negative, na, slow, na
আপনাদের নেটওয়ার্ক নিয়ে একটু গবেষণা করুন। আপনাদের নেটওয়ার্ক দিয়ে ডেটা ব্যবহার করলে মোবাইলের চার্জ বেশি যায়। এটার কারণ কি? সংকেতও ঠিক মতো পায় এর পরেও, negative, na, slow, na
টেলিটক সিম হচ্ছে কৃষি ব্যাংকের মত অবস্থা!, negative, na, na, na
এখনো টেলিটক নেটওয়ার্ক এর বাহিরে, negative, na, slow, na
"আমি ১ টা ব্যবহার করি, নেটওয়ার্ক পাই না।", negative, na, slow, na
যাদের নেটওয়ার্কই থাকে না তার কাছে ৪জি আর ৫জি দিয়ে কি আসে যায়।, negative, na, slow, na
টেলিটক আপনাদের অ্যাপ ঠিক করুন ১মাস ধরে কোনো কাজই করে না ঠিক মতো, negative, moderate, slow, na
"দেশের টাকা দেশে রাখার জন্য অনেক চেষ্টা করতেছি কিন্তু পারছি না রাখতে আপনাদের কারণে। আপনাদের সিম মোবাইলের কাভারের নিচে রাখা, কি করবো সিম সংযোগ করলে ইন্টারনেট চালানো তো দুরের কথা ফোন করার জন্য নেট খুঁজে পায় না (সিলেট জেলার কানাইঘাট উপজেলা)", negative, na, slow, na
আমাদের বাসার পাশে একটা দিয়েন, neutral, na, na, na
