text,sentiment,eof,responsiveness,accuracy
"গতকাল রাতে ১ জিবি কিনে শুধু ফেসবুকে ৩/৪ মিনিট স্ক্রল করেছি কোনো ভিডিও দেখি নাই, তারপর দেখি ১ জিবি শেষ। এটা কেমন ধরনের চুরি?", negative, na, na, low
"নেটওয়ার্ক তো সুপার ফাস্ট হাজার টা ভিডিও দেখলেও এক এমবিও যায় না, এটাই তো চায় বাঙ্গালী", positive, na, fast, high
"আচ্ছা আপনারা অফার নিয়ে এরকম লাফাচ্ছেন কেন? আপনাদের কি লজ্জা শরম বলতে কিছু নেই? মন্তব্যগুলো পড়েন না মানুষের? আগে নেটওয়ার্ক উন্নত করুন, ২জি ঠিকমত পাওয়া যায় না কথা বলা যায় না ঘরে ঢুকে, আর আপনারা অফার নিয়ে মজা করেন।", negative, na, slow, na
"আসসালামু আলাইকুম আমি একজন দোকানদার টেলিটকের রিচার্জ বিক্রি করি কিন্তু দুঃখের বিষয় হলো ব্যালেন্স যথাযথ পাওয়া যায় না। পরিবেশককে ১৫-২০ বার ফোন করার পর ব্যালেন্স দিতে আসে, কখনো ১০ দিন পর আবার ২০ দিন পর। অথচ আমি সদরের মধ্যে অবস্থান করছি এবং তাদের খুব কাছাকাছি। এরকম সমস্যা সমাধানের জন্য আপনারা কোন ব্যবস্থা নিবেন কিনা", negative, low, slow, low
বর্ণমালাতে আবার এক পয়সা এক সেকেন্ড পালস করুন, neutral, na, na, na
এক জিবি ১৩ টাকা প্রতিদিন মেয়াদ দিলে ভালো হয়। আপনারা শুধু শুক্রবার শনিবার দিয়েছেন।, neutral, na, na, na
"বাজে গ্রাহক সেবা, সাধারণ ডেটা প্যাক দিয়ে শুধু ফেসবুকই চলে আমার এলাকায়, নেট পুরো ৪জি থাকার পরও। হেল্পলাইন বন্ধ, অভিযোগ করারও উপায় নাই। এত বাজে সেবা দিলে গ্রাহক কেন ব্যবহার করবে। চরম দেশপ্রেমী না হলে টেলিটক ব্যবহার করা উচিত না", negative, low, slow, low
দিনাজপুর জেলার ঘোড়াঘাট উপজেলার রাণীগঞ্জ বাজারে ৪জি নেটওয়ার্ক দেওয়ার অনুরোধ করতেছি।, neutral, na, na, na
"আগে নেটওয়ার্ক কভারেজ উন্নতি করুন তারপর যত পারেন অফার দিন, লুফে নেব।", negative, na, na, na
"৪জি তো পাই না, এমবি নিয়ে কি করি?", negative, na, slow, na
এমবি আছে কিন্তু নেট চলে না, negative, na, slow, low
টেলিটক আপনাদের টেলিটক সিমের থেকে এয়ারটেল ও রবি সিম অনেক ভালো।, negative, na, na, na
অ্যাপে দেখলাম ১৩টাকায় ১জিবি ২দিন। বুধবার রাতে কেনার পর দেখি মেয়াদ দিয়েছে ১সপ্তাহ! কিন্তু নেট চলেনা। আজকে দেখি আবার চলতেছে। অফারটা যদি শুধু শুক্র শনিবারের জন্য হয় তাহলে এক সপ্তাহ মেয়াদ দিল কোন দুঃখে? আমি আরো ফোনের সমস্যা ভেবে তিন চারবার রিস্টার্ট দিয়েছি।, negative, moderate, slow, low
টেলিটক নেটওয়ার্ক সমস্যা করে আমার সিমের সবসময় ‘নো সার্ভিস’ উঠে থাকে বিগত কয়েক মাস ধরে, negative, na, slow, na
টেলিটকের জেন-জি প্যাকেজের অফার গুলো সবার জন্য উন্মুক্ত করে দেয়ার দাবি জানাই।, neutral, low, na, na
"বন্ধের দিন গুলো সবার জন্য বিনামূল্যে করা হোক, নেট সবার জন্য।", neutral, na, na, na
শনিবার কি কাস্টমার কেয়ার খোলা থাকে, neutral, na, na, na
এটার মেয়াদ কত?, neutral, na, na, na
নেটওয়ার্ক বিহীন জিবি কিনে কি করবে?, negative, na, slow, na
"দোকান ভাড়ার সাথে অগ্রিম নামক লক্ষ লক্ষ টাকার প্রথা বাতিলের দাবি! কমবে বেকার সমস্যা, বাড়বে উদ্যোগিতা!", neutral, na, na, na
টেলিটক জেন জি সিমে নিতে পারবো?, neutral, na, na, na
আগে গ্রাম পর্যায়ে নেটওয়ার্ক কভারেজ দিন।, neutral, na, na, na
"কিভাবে সিম রিপ্লেস করবো, কত টাকা লাগে, সাভারে কোথায় করবো বলেন প্লিজ, কবে খোলা থাকে অফিস বিস্তারিত জানান", neutral, low, na, na
"বাজে সিম, বাজে নেটওয়ার্ক", negative, na, slow, na
বর্নমালা সিমে ১ সেকেন্ড পালস পাবো কিভাবে?, neutral, na, na, na
"বড়খাতা, হাতিবান্ধা, লালমনিরহাট ২জি নেটওয়ার্ক", negative, na, slow, na
"এক সেকেন্ড পালসের কোনো সিম নেই আপনাদের। অথচ এই ১ সেকেন্ড পালসের জন্যেই জিপি থেকে মাইগ্রেট করে স্বাধীনে এসেছিলাম, অনেক দিন ১ সেকেন্ড পালস ব্যবহার করেছি কিন্তু হঠাৎ সেটাকে ১০ সেকেন্ডে নিয়ে যাওয়া হলো। আর কোনো প্যাকেজেই ১ সেকেন্ড পালস নাই। এটা রীতিমতো ধোকাবাজি।", negative, na, na, low
সিম কোথায় পাওয়া যাবে, neutral, low, na, na
"এমবি দিয়া কি করবো, আগেরগুলোই নেটওয়ার্ক এর অভাবে পচে যাচ্ছে", negative, na, slow, na
"পুরাই ফালতু সিম, নিজের টাকা দিয়ে নেট কিনেও নেট সক্রিয় হয় না", negative, low, slow, low
"টেলিটক যদি টেলি সেবা দেয়ার ইচ্ছা থাকে তো অন্য অপারেটরের মত দিন। এই ৫জি যুগে ২জি সেবা দেন আপনারা, লজ্জাজনক। আপনাদের লজ্জা হওয়া উচিত। গ্রামে ওয়াইফাই নাই, আপনাদের ইন্টারনেট মূল্য কম, আপনাদেরও ব্যবসা ভালো হবে, আমরা যারা গ্রামে থাকি তাদেরও উপকার হবে। গ্রাম সাইডে ৪জি না পারলেও ৩জি নিয়ে আসুন। ২জি সেবা দিয়া লজ্জা দেবেন না।", negative, na, slow, na
নাহিদের নেটওয়ার্ক চলে না, negative, na, slow, na
মিরপুর ১৪ তে আপনাদের কোন কাস্টমার কেয়ার আছে?, neutral, na, na, na
এই অফার নিলে চলে না, negative, na, na, low
"১০ বছর ধরে টেলিটক ব্যাবহার করি আজও ইন্টারনেট ব্যাবহার করতে পারলাম না। কবে আসবে আমার এলাকায় ৪জি, দামুড়হুদা, চুয়াডাঙ্গা।", negative, na, slow, na
রাজবাড়ী জেলায় কোন কোন এরিয়াতে আপনাদের ৪জি টাওয়ার আছে, neutral, na, na, na
বিদ্যুৎ গেলে নেটওয়ার্ক চলে যায়, negative, na, slow, low
"বরাবর, টেলিটক ব্যবস্থাপক পরিচালক। বিষয়: নেটওয়ার্ক জনিত সমস্যা। আমার এলাকাতে টেলিটকের টাওয়ার আছে কিন্তু বিদ্যুৎ চলে গেলে নেটওয়ার্ক থাকে না। মহামান্য টেলিটক ব্যবস্থাপক পরিচালকের নিকট আমার আবেদন এই যে আমার এলাকাতে টেলিটকের নেটওয়ার্কের মান উন্নয়নমূলক কাজ করার বিনীত অনুরোধ। সেই সাথে টেলিটকের থ্রিজি নেটওয়ার্ক বন্ধ করে ফোরজি সেবা দেওয়ার জোর দাবি জানাচ্ছি। ঠিকানা: গ্রাম- মেরাতলী, থানা- কুলিয়ারচর, জেলা- কিশোরগঞ্জ।", negative, low, slow, low
"টেলিটক কি লুটের রাজধানীতে পরিণত হয়েছে! কথাই বলা যায় না। আগে তাও ফোনে কথা বলা যেত, এখন তাও বলা যায় না।", negative, na, slow, na
নতুন নতুন টাওয়ার বসান। বিদ্যমান টাওয়ার গুলোর মান বাড়ান। এভাবে হয় না।, neutral, na, na, na
নেটওয়ার্কই পাওয়া যায় না। আবার এমবি দিয়ে কি করবো!, negative, na, slow, na
"আমি ছাড়াও অনেকে টেলিটক সিম ব্যবহার করে, কিন্তু আমাদের এলাকায় টেলিটকের ৩জি বা ৪জি এর কাভারেজ নাই। যদি আমাদের এলাকায় ২জি টাওয়ারটা হালনাগাদ করে ৩জি বা ৪জি করলে অনেক মানুষ উপকৃত হতো। টাওয়ার স্থান: ইচ্ছাখাদা বাজার (২জি), টাওয়ার কোড: মাগুরা ০০১৫, গ্রাম: মিজাপুর মোল্লাপাড়া, ডাকঘর: হাজরাপুর, ইউনিয়ান: হাজরাপুর, থানা: মাগুরা সদর, জেলা: মাগুরা।", negative, na, slow, na
আগে নেটওয়ার্ক দেন তারপর অফার, negative, na, na, na
"দীর্ঘদিন যাবৎ টেলিটকের সাথে যুক্ত হয়ে আছি এবং টেলিটক ব্যবহার করে আসছি। কিন্তু দুঃখজনক হলেও সত্য আমার এলাকায় আজ পর্যন্ত টেলিটকের ফোরজি নেটওয়ার্ক কাভারেজ পাইনি। প্রধান রাস্তা থেকে ২০ থেকে ২৫ টা বাড়ির পর আমার বাসা। অথচ আমার রুম থেকে টেলিটকের ফোরজি নেটওয়ার্ক আমি কোনদিনই পাইনি। ছাদে উঠলে শুধুমাত্র পাই ফোরজি নেটওয়ার্ক। তাছাড়া সব সময় তো ফোরজি নেটওয়ার্কের জন্য ছাদে উঠে বসে থাকা সম্ভব নয়। এটা খুবই কষ্টকর এবং দুঃখজনক আমার জন্য যে দেশের জন্য দেশের সিম ব্যবহার করে যদি সুবিধা না পাই, তাহলে মনটা খুবই খারাপ হয়ে যায়। এজন্য আমি টেলিটক কর্তৃপক্ষের সদয় দৃষ্টি আকর্ষণ করছি, যত দ্রুত সম্ভব আমার এলাকায় যদি ফোরজি কাভারেজ নেটওয়ার্ক প্রতিষ্ঠা করলে এলাকাবাসী অনেক উপকৃত হতো।", negative, na, slow, na
জেন-জি ই-সিম কোথা থেকে সংগ্রহ করতে হবে?, neutral, low, na, na
টেলিটকের ই-সিম হবে? চট্টগ্রাম?, neutral, low, na, na
টেলিটক সিমের মূল্য কত?, neutral, low, na, na
মেয়াদ কয়দিন, neutral, na, na, na
"সিমের নেটওয়ার্কই থাকে না, বিদ্যুৎ চলে গেলে তো কথাই নাই। আর ইন্টারনেট ব্যবহার করা বিলাসিতা। আগে সব জায়গায় নেটওয়ার্ক ৪জি চালু করে নেটওয়ার্ক সিস্টেম ঠিক করুন নাহলে শেষে সিম বন্ধ করে বসে থাকা লাগবে আমাদের।", negative, na, slow, low
"একটা টেলিটক সিম ক্রয় করতে চাই কিভাবে করতে পারি, লোকেশন হাটহাজারী", neutral, low, na, na
"টেলিটকের নেটওয়ার্ক বর্তমান খুবই খারাপ, আশা করি ঠিক করার ব্যবস্থা করবেন", negative, na, slow, na
টেলিটক সিম রিপ্লেস করবো কিভাবে, neutral, low, na, na
মেয়াদ কতদিন, neutral, na, na, na
বর্ণমালা সিমের জন্য অনলাইনে রেজিস্ট্রেশন করেছি। কিন্তু এখনো এসএমএস আসে নাই। কাস্টমার কেয়ার থেকে কি সিম তোলা যাবে, negative, moderate, slow, low
টেলিটকে কত ডায়াল করে টাকা ধার নেয়, neutral, low, na, na
"এমবি ব্যবহার করতে পারছি না, এতদিন তো থ্রি জি দিয়ে ব্যবহার করা গেছে, আজ কি হলো", negative, na, slow, low
"সবই ঠিক আছে, বিকাশের সাথে সমস্যাটা কি? অ্যাপস পেমেন্ট অপশনে বিকাশ নেই কেনো?", negative, moderate, na, na
কাস্টমার কেয়ার কয়টা থেকে কয়টা পর্যন্ত খোলা থাকে?, neutral, na, na, na
আপনাদের কোন সার্ভিস পাওয়া যাবে এখন, neutral, na, na, na
"টেলিটকের কর্মকর্তা এবং কর্মচারীবৃন্দ এবং যারা দায়িত্বে রয়েছেন তাদের দৃষ্টি আকর্ষণ করে বলছি আপনাদের অফারের কথা বাদ দেন, আগে টেলিটকের নেটওয়ার্কের সিস্টেমের উন্নতি করেন, না হলে গ্রাহক হারাতে হবে, গ্রাহক কমে যাবে টেলিটকের। আমি স্বাধীন প্যাকেজ ব্যবহার করি কিন্তু ভালো নেট পাইনা, শুধু বাটন ফোনে রেখে কথা বলার উপযোগী।", negative, na, slow, na
রিসিভ কলে আমার টাকা কাটে এর থেকে পরিত্রাণের উপায় কি?, negative, na, na, low
টেলিটক 'স্বাধীন' নতুন সিমের অফার কি?, neutral, na, na, na
বর্তমান দাম কত, neutral, low, na, na
মেয়াদের কি অবস্থা! সব কিছুর পরিবর্তন হচ্ছে কিন্তু এটার কবে হবে? তাহলে কি এখনো টেলিযোগাযোগ খাতে উইপোকা রয়ে গেছে?, negative, na, na, na
নবীনগর ফোর-জি চালু হয়েছে।, neutral, na, na, na
সবই ঠিক আছে ৪জি ভোল্টি কবে পাবো?, neutral, na, na, na
এখানে কি এমন কেউ আছেন যার টেলিটক সিম বন্ধ হয়ে গেছে আপনা আপনি। অনুগ্রহ করে জানাবেন।, negative, low, na, low
কোনদিন যেনো এই বাজে নেটওয়ার্ক ঝামেলার জন্য এই সিম খুলে একবারে পানিতে ডুবাই।, negative, na, slow, na
"বাজে নেটওয়ার্ক, ঢাকায় ঘরে বসে নেট থাকে না। এমন সিম নেটওয়ার্ক বাংলাদেশে দ্বিতীয়টা নেই। অথচ দেশি সিম টেলিটক", negative, na, slow, na
নারায়ণগঞ্জ আপনাদের কোন কাস্টমার কেয়ার আছে, neutral, na, na, na
আপনাদের অতিদ্রুত স্বল্পমূল্যে শর্তহীন আনলিমিটেড প্যাকেজ বের করা উচিত।, neutral, na, na, na
"অনেক সময় সিমের নেটওয়ার্ক চলে যায়, ৩-৪ ঘন্টা নেটওয়ার্ক থাকে না", negative, na, slow, na
প্রত্যেকটা অফিস আদালতে টেলিটক সিমকে বাধ্যতামূলক করা হোক। সকল অফিসিয়াল কার্যক্রম ও ইন্টারনেট এই সিমে ব্যবহার করতে হবে, neutral, na, na, na
"মেয়াদ কমিয়ে দিলে আর কি লাভ হল, আপনাদের নেটওয়ার্কের এমনিতেই বাজে অবস্থা তার ওপর মেয়াদ কমাচ্ছেন।", negative, na, na, na
এই অফার কতদিন থাকবে, neutral, na, na, na
ভাই নেটওয়ার্ক ঠিক করে অফার গুলো দেন, negative, na, slow, na
এই অফার কত দিন থাকবে, neutral, na, na, na
নেটওয়ার্ক সহজলভ্য করেন, neutral, na, na, na
আমাদের এলাকায় বর্তমানে নেটওয়ার্ক খুবই দুর্বল, negative, na, slow, na
টেলিটক বর্ণমালাতে ১ সেকেন্ড পালস চাই, neutral, na, na, na
এত এত অফারের প্রয়োজন নেই গ্রাহকদের। বাংলাদেশের ৯৫% জায়গায় আপনাদের কোনো টাওয়ার নেই। আর সেই কারণে নেটওয়ার্ক সমস্যা। সুতরাং আগে ৪জি নেটওয়ার্ক বৃদ্ধি করুন তারপর অফারের কথা বলুন।, negative, na, slow, na
কথা বলার নেটওয়ার্কটা ঠিক করেন আগে, negative, na, slow, na
এমবি এতো দ্রুত শেষ হয় কেন, negative, na, fast, low
যে নেটওয়ার্ক ৫০% বোনাস সহ ১ বা ৩ দিনের প্যাকেজ কিনলে ১০% ব্যবহার করাই মুশকিল, negative, na, slow, na
আমাদের মাগুরাতে কি ৪জি নেটওয়ার্ক চালু আছে কিনা, neutral, na, na, na
নেটওয়ার্ক ঠিকমতো পাওয়া যায় না নড়িয়া থানা নড়িয়া বাজারে, negative, na, slow, na
টেলিটকের নেটওয়ার্ক এত দুর্বল কেন, negative, na, slow, na
অফারগুলো নিয়ে কি মানুষ সবাই পুজো করবে, negative, na, na, na
আগের তুলনায় বর্তমানে নেটওয়ার্ক অনেক ভালো হয়েছে ধন্যবাদ, positive, na, na, high
টেলিটক কলরেট এবং এমবির দাম কম করা হোক ছাত্রদের জন্য, neutral, na, na, na
দিনাজপুর পার্বতীপুরে আপনাদের নেটওয়ার্ক ভুয়া, negative, na, na, low
বাজে নেটওয়ার্ক, negative, na, na, na
কিছু কিছু সিদ্ধান্তের জন্য সময় বেশী নেওয়ার কোনো প্রয়োজন নেই যদি সেগুলো ধাপে ধাপে করা হয়। মোবাইল এর কল রেটের পরিমাণ ধাপে ধাপে কমানো। আর ইন্টারনেট এর সর্বনিম্ন মেয়াদ হোক ন্যূনতম ১ মাস। সব একসাথে করতে গেলে সময়সাপেক্ষ ব্যাপার। এতে জনগণের আকাঙ্খার প্রতিফলন ঘটবে। সেই সাথে সব ইউনিয়নে টেলিটকের ৪জি চালু করুন। দেশের টাকা দেশেই থাকুক। প্রয়োজনে প্রতিটি ভোটের আইডি কার্ড এর বিপরীতে একটি টেলিটক সিম দিন। তাতে কল রেট কম রাখুন। আমরা বাংলাদেশীরা নিজের দেশকে অনেক ভালবাসি। আমরা নিজ দায়িত্বে নিকটবর্তী টেলিটক সেন্টার বা সরকার নির্ধারিত জায়গা থেকে নিজ দায়িত্বে তা সংগ্রহ করবো এবং সুবিধা ভালো পেলে কে তা ব্যবহার করবে না?, positive, low, na, na
এমবির দাম ঠিক আছে কিন্তু মেয়াদ ঠিক নেই, negative, na, na, na
"৪জি নেই, গতি খুব ধীর", negative, na, slow, na
আগামী প্যাকেজ ১ সেকেন্ড পালস চাই, neutral, na, na, na
নোয়াখালীতে টেলিটকের ই-সিম কোথায় পাওয়া যাবে, neutral, low, na, na
ময়মনসিংহ সিটিতে ই সিম আসবে কবে, neutral, na, na, na
