text,sentiment,eof,responsiveness,accuracy
বর্তমানে আপনাদের পুরনো সিম প্রতিস্থাপন কত টাকা এবং নওগাঁ জেলায় আপনাদের ফোরজি নেটওয়ার্ক আগে একেবারেই ছিল না এখন কি ফোরজি সেবা পাওয়া যাচ্ছে আশাকরি জানাবেন, neutral, low, na, na
আপনাদের নেটওয়ার্ক ব্যবস্থার উন্নয়ন করুন, neutral, na, na, na
নেটওয়ার্ক আগে ঠিক করুন সারা বাংলাদেশ তারপর অফার দিন, negative, na, na, na
"আপনাদের নেটওয়ার্ক এর অবস্থা খুব বাজে, আগে আপনাদের নেটওয়ার্ক ঠিক করুন। কোনো ভাবেই নেট চালাতে পারিনা। বাজে একটা নেটওয়ার্ক। নেটওয়ার্ক যদি চালাতে না পারি অফার দিয়ে কি করবো", negative, na, slow, na
"বরাবর, টেলিটক ব্যবস্থাপক পরিচালক। বিষয়: নেটওয়ার্ক জনিত সমস্যা। আমার এলাকাতে টেলিটকের টাওয়ার আছে কিন্তু বিদ্যুৎ চলে গেলে নেটওয়ার্ক থাকে না। মহামান্য টেলিটক ব্যবস্থাপক পরিচালকের নিকট আমার আবেদন এই যে আমার এলাকাতে টেলিটকের নেটওয়ার্কের মান উন্নয়নমূলক কাজ করার বিনীত অনুরোধ। সেই সাথে টেলিটকের থ্রিজি নেটওয়ার্ক বন্ধ করে ফোরজি সেবা দেওয়ার জোর দাবি জানাচ্ছি। ঠিকানা: গ্রাম- মেরাতলী, থানা- কুলিয়ারচর, জেলা- কিশোরগঞ্জ।", negative, low, slow, low
টেলিটকের কর্পোরেট সিম ব্যবস্থা আছে?, neutral, na, na, na
"কেন আমি ম্যাগনেসা কোম্পানিতে কাজ করি? ১. বিনা বিনিয়োগের কাজ। ২. চাপ নাই। ৩. লক্ষ্যমাত্রা নাই। ৪. ঝুঁকি নাই। ৫. ডিমোশন নাই আছে প্রমোশনের দারুন সুযোগ। ৬. বহু মানুষের কর্মের ব্যবস্থা করা যায়। ৭. প্যাসিভ ইনকামের সুযোগ। ৮. বিশ্বের অধিক দেশে কাজ করা যায়। ৯. জেনারেশন টু জেনারেশন ইনকাম পাওয়ার সুযোগ। ১০. সময় স্বাধীনতার সুযোগ। ১১. অর্থনৈতিক স্বাধীনতার সুযোগ। ১২. অর্গানিক প্রোডাক্ট স্বাস্থ্যের উপর কাজ করে দুর্দান্ত ভাবে। ১৩. আমার সময় কে কাজে লাগিয়ে উদ্যোক্তা হয়ে ইনকাম করার সুযোগ। ১৪. শতভাগ হালাল ইনকাম। ডিজাইন করুন আপনার জীবন মহান কোম্পানি ম্যাগনেসা গ্লোবালের সাথে। শুভেচ্ছান্তে, রজব আলী রাজীব উদ্যোক্তা, ম্যাগনেসা গ্লোবাল কোম্পানি।", neutral, na, na, na
"মেয়াদের কোনো নেই বাঁধা, নেটওয়ার্কের বাঁধা সবখানে। এই সিম যে চালাই না, সেটা টেলিটকও জানে", negative, na, slow, na
"টেলিটক বর্ণমালা, অপরাজিতা সিম পরিবর্তনের ফি কত?", neutral, low, na, na
শনিবার আপনাদের কাস্টমার কেয়ার সেবা চালু থাকে নাকি বন্ধ, neutral, na, na, na
"নেটওয়ার্ক পায় না অনেক জায়গায়, এটাই সমস্যা", negative, na, slow, na
আমাদের এলাকায় টাওয়ারও নাই তাই গ্রাহকও নাই। আমি চাইছিলাম যদি টেলিটক আমার এলাকায় টাওয়ার বসানোর জন্য জায়গা চাই তাহলে বিদ্যুৎসহ জায়গা আমি ব্যবস্থা করে দিব কারণ দেশীয় ফোন এগিয়ে থাকুক আর এতে আমারও অবদান থাকুক।, positive, na, na, na
নেট কাভারেজ না থাকলে ডেটা দিয়ে কি করবো?, negative, na, slow, na
আমি এসএসসি ২০১৪ ব্যাচের ছাত্র। ২০১৮ সালে আগামী সিমের জন্য রেজিস্ট্রেশন করি কিন্তু আমার দেয়া যোগাযোগ নম্বরে সিম উত্তোলনের কোন নোটিশ পাই নি। যার কারণে সিম উত্তোলন করতে পারি নি। এখন কি আর কোন সুযোগ আছে?, negative, low, slow, na
"আমার টেলিটক নম্বরে রিচার্জ করা যাচ্ছে না, দয়া করে সাহায্য করুন", negative, low, na, na
আগামী সিম রেজিস্ট্রেশনের হারানো ওটিপি নম্বর কি কোনো ভাবে পাওয়া যাবে? একবার রেজিস্ট্রেশন করা হয়েছিল কিন্তু সিম তোলা হয় নি। এখন কি আগামী সিম তোলার কোনো উপায় আছে? থাকলে জানাবেন প্লিজ।, negative, low, na, na
ইয়োথ থেকে স্বাগতম প্যাকেজে মাইগ্রেট করার উপায় কি?, neutral, moderate, na, na
এত বেশি রেট!, negative, na, na, na
"আমার সিম লাগবে, কোথায় গেলে পাব।", neutral, low, na, na
আগামী সিম নিলে কি কি লাগবে ও কিভাবে, neutral, low, na, na
সিম কোন প্যাকেজে আছে তা বুঝব কিভাবে?, neutral, moderate, na, na
"স্যার, আমি ২০১৬ সালে আগামী সিমটা রেজিস্ট্রেশন করেছিলাম। কিন্তু সিম উঠাতে পারিনি। এখন কাস্টমার কেয়ারে গেলে আগের এসএমএসের রেজিস্ট্রেশন কপি চায়। কিন্তু সেটা আমার কাছে নেই। এখন কি করবো, স্যার", negative, low, slow, na
যদি আমার রোল নাম্বার নিয়ে অন্য কেউ আগামী সিম রেজিস্ট্রেশন করে তবে সেটা কিভাবে কি, negative, low, na, low
মাঝে মাঝে নেটওয়ার্ক হারিয়ে যাচ্ছে কেন বুঝতেছি না, negative, na, slow, na
"কিভাবে আগামী সিম পাবো অথবা, আগামী সিমের জন্য নিবন্ধন করবো?", neutral, low, na, na
আগামী সিমের অফার ও কলরেট সম্পর্কে জানতে চাই।, neutral, na, na, na
আমার একটা সিম লাগে, neutral, low, na, na
"টেলিটক আগামী প্যাকেজের সিমে ১৭ টাকায় ১ জিবি, ২১ টাকায় ১ জিবির অফার গুলো কি বন্ধ হয়ে গেছে?", neutral, na, na, na
আগামী ও বর্ণমালার মধ্যে সেবার পার্থক্য কি? এটা কি আজীবন থাকবে? এতে কি ৪জি ব্যবহার করা যাবে? এগুলোতে টেলিটকের সব সেবা পাওয়া যায় কি? না পাওয়া গেলে আমাকে কোন সিম নিতে হবে?, neutral, moderate, na, na
এত বেশী কল রেট করে জনগণের কি লাভ করল মোবাইল কোম্পানিরা?, negative, na, na, na
কুড়িগ্রাম জেলার ভুরুঙ্গামারী উপজেলায় সিম পাওয়ার কোনো উপায় আছে?, neutral, low, na, na
আমি ২০১১ সালে আগামী সিম নিয়েছিলাম পরে মালয়েশিয়া পড়াশোনার কারণে সিমটি বায়োমেট্রিক করা হয়নি। সিমটিও হারিয়ে গিয়েছে আমি কি ভাবে পুনরায় সিমটা পাব।, negative, low, na, na
টেলিটকের নেটওয়ার্কের এত দুরবস্থা কেন? ইন্টারনেট তো চলে না বললেই চলে। এই সমস্যা কি কোনদিন ঠিক হবে না?, negative, na, slow, na
বর্ণমালা নতুন সিম নিলাম ৩জি দেখায় কেন এখন তো ৪জি, negative, na, slow, na
"আগামী সিমের বায়োমেট্রিক রেজিস্ট্রেশন কি এখন চালু আছে? আমি কয়েকবছর আগে একটা আগামী সিম নিয়েছিলাম কিন্তু বায়োমেট্রিক রি-রেজিস্ট্রেশন করতে পারিনি। এখন সিমটাতে নেটওয়ার্ক আসছে, কল আসছে কিন্তু ব্যবহার করতে পারছিনা। এখন আমি কি করতে পারি, জানাবেন, প্লিজ", negative, low, na, na
"আগামী সিমের জন্য আবেদন করছিলাম গত বছর, কিন্তু সিমটা তোলা হয় নাই, সিম এখন নেওয়া যাবে কাস্টমার কেয়ারে গিয়ে", neutral, low, na, na
নতুন উত্তোলনকৃত টেলিটক আগামী সিমের অফার পেতে ১ম কত টাকা রিচার্জ করব?, neutral, na, na, na
আমি আগামী সিমের জন্য রেজিস্ট্রেশন করতে চাচ্ছি। কিন্তু আমার এসএসসি পাসের রোল কেন চাওয়া হচ্ছে?, neutral, low, na, na
আমার আগামী সিমটা দীর্ঘদিন অব্যবহৃত থাকায় এখন আর কাজ করছে না। সিমটা আমি এসএসসির পর নিয়েছিলাম। তখন অপ্রাপ্তবয়স্ক থাকায় আমার এক আত্মীয়ের নামে সিমটা নেওয়া হয়েছিল। সিমের কাগজপত্র আছে কিন্তু সেই আত্মীয় এখন নেই। সে ক্ষেত্রে এখন আমার করনীয় কি?, negative, low, na, na
ইয়োথ থেকে বর্ণমালায় মাইগ্রেট করা যাবে কি?, neutral, moderate, na, na
টেলিটকের ইন্টারনেট প্রোফাইল নাম আর এপিএন কি, neutral, moderate, na, na
"আমার একটা টেলিটক আগামী সিম আছে, কিন্তু বায়োমেট্রিক রেজিস্ট্রেশন করা নাই। এখন সিমটি ব্যবহার করতে হলে, কি করতে হবে?", negative, low, na, na
"আমার ছাত্র বর্ণমালা সিম হারিয়ে গেছে, ২০১৭ সালে, সিমটি বায়োমেট্রিক রেজিস্ট্রেশন করা ছিলো না, এখন ওই সিম উঠানো যাবে? এসএসসির সনদপত্র দিয়ে নতুন সিম রেজিস্ট্রেশন করা যাচ্ছে না", negative, low, na, na
আমার আগামী সিম অনেক দিন ব্যবহার না করায় অকার্যকর হয়ে গেছে। রিচার্জ বা কল কোনোটাই হয় না। আমার সিম কিভাবে সচল করবো?, negative, low, na, na
ভালো সিম, positive, na, na, high
"সত্যি বলতে আগামীর প্যাকেজের সাথে অন্যান্য প্যাকেজের মধ্যে তফাৎ নেই, এই ব্যাপারে আরেকটু ভেবে দেখবেন আশা রাখি", neutral, na, na, na
"নেটওয়ার্ক একদম বাজে, ২জিও নেটওয়ার্ক পায় না থানা পর্যায় এলাকাগুলোতে, অথচ সরকারি মোবাইল অপারেটর", negative, na, slow, na
ঠিক আছে, neutral, na, na, na
আমি টেলিটকের ডিলার আনতে চাই। এজন্য আমাকে কী করতে হবে?, neutral, low, na, na
কিভাবে মিসডকল অ্যালার্ট সেবা বন্ধ করবো?, neutral, moderate, na, na
"আমার একটা ছাত্র সিম লাগে, কিভাবে পেতে পারি?", neutral, low, na, na
"শেখ কামাল টেক্সটাইল ইন্জিনিয়ারিং কলেজ, ঝিনাইদহতে টেলিটকে কোন নেটওয়ার্ক থাকে না। বাসাতে কথা বলতে পারি না। কোন সমাধান কি আছে?", negative, na, slow, na
"আমি একটি বর্ণমালা সিম নিয়েছিলাম, কিন্তু অনেকদিন ব্যবহার করা হয়নি তাই এখন আর সিম কাজ করছে না কোন কল যাচ্ছে না। হয়তো বায়োমেট্রিক রেজিস্ট্রেশন করতে হবে। কিন্তু সেটা কিভাবে করবো", negative, low, na, na
একই রোল নাম্বার দিয়ে কি বর্ণমালা আর আগামী দুটো সিমে রেজিস্ট্রেশন করা যায়?, neutral, low, na, na
আমার একটা সিম তিন বছর আগে হারিয়ে গেছে। বায়োমেট্রিক রেজিস্ট্রেশন করতে পারিনি। এখন কি সিম তোলা যাবে?, neutral, low, na, na
আমার ন্যাশনাল আইডি কার্ড না থাকায় আমি বায়োমেট্রিক রেজিস্টেশন করতে না পারায় আমার আগামী সিমটি বন্ধ হয়ে গেছিল। এখন আমার জাতীয় পরিচয়পত্র অনলাইন কপিটি আছে। আমি কি এখন আমার সেই সিম আবার তুলতে পারবো কিনা জানালে উপকৃত হবো।, neutral, low, na, na
আগামী সিমে কিছুদিন আগেও ২১ টাকায় ১ জিবি দিতো। সেটা এখন আর দেয়না কেনো? এখন তাহলে ৭দিন মেয়াদে কত টাকায় ১ জিবি করে পাওয়া যাচ্ছে?, negative, na, na, na
"আচ্ছা ভাই, টেলিটক আগামী সিমটা নেওয়ার জন্য একটা টেলিটক সিম দিয়ে রেজিস্ট্রেশন করেছিলাম কিন্তু আমার যোগাযোগ নম্বর যেটা দিয়েছিলাম সেখানে রেজিস্ট্রেশন আইডি নং, ওটিপি না দিয়ে যেই টেলিটক সিম দিয়ে রেজিস্ট্রেশন করেছিলাম সেখানে দিয়ে দিয়েছে! তো আমি ছবি তুলে রাখছি, মেসেজ ফরওয়ার্ড করেও নিয়েছি রেজিস্ট্রেশন আইডি নং এবং ওটিপি এর। এটা দিয়ে সিম তোলা যাবে কি?", negative, low, na, na
"টেলিটকে ব্যালেন্স ট্রান্সফার করতে চাচ্ছি, কিন্তু কিছুতেই পারছি না। এতো বাজে সেবা দিলে কিভাবে?", negative, moderate, na, low
আগামী সিম কখন দেয়া হবে?, neutral, low, na, na
এখন টেলিটক সিম ক্রয় করা যাচ্ছে না কেন?, negative, low, na, na
"টেলিটক আগামী সিমটি হারিয়ে বা নষ্ট হয়ে গেলে, প্রতিস্থাপন করার পদ্ধতি কী? কোনো চার্জ লাগবে কী?", neutral, low, na, na
নেট অফার ঠিক আছে আগের মত?, neutral, na, na, na
"আমার অবস্থান নগর বাথান, বাজার পাড়া, সদর, ঝিনাইদহ। আমিও একজন আগামী ব্যবহারকারী। এখানে কোনো ৩জি নেটওয়ার্ক কভারেজ নেই। পরিশেষে উল্লেখ্য যে আমাদের অবস্থান আমাদের ঝিনাইদহ জেলা শহর থেকে মাত্র ৫ কিমি দূরে। ঝিনাইদহ শহরে ৩জি আছে কিন্তু আমাদের অঞ্চলে নেই। দয়া করে এই শ্বাসরুদ্ধকর পরিবেশের দিকে মনোযোগ দিন অথবা আমাকে অপারেটর পরিবর্তন করতে হবে।", negative, na, slow, na
বর্ণমালা সিমের নেট প্যাকেজ কল রেট ও অন্যান্য অফারগুলোর বিস্তারিত জানাবেন প্লিজ, neutral, na, na, na
"আগামী সিম রেজিস্ট্রেশনের জন্য আমি নিয়ম অনুযায়ী মেসেজ করি, কিন্তু আমার কাছে তার কোনো ফিরতি মেসেজ আসে নাই", negative, low, slow, na
আমি কিভাবে টেলিটক সিম ক্রয় করতে পারি?, neutral, low, na, na
সিলেটে কি টেলিটকের কাস্টমার কেয়ার আছে, neutral, na, na, na
"নবীনগর, ব্রাহ্মণবাড়িয়ায় টেলিটকের কোন সিম পাওয়া যায় না, আমার কাছে বাকী সব কোম্পানির মোবাইল সিম পাওয়া যায়, আশা করি নজর দিবেন, আমাকে দিলে আমি নিতে রাজি", negative, low, na, na
"এটা কি শুধু ছাত্র ছাত্রীদের জন্য, না অন্য কেউ কিনতে পারবে না?", neutral, low, na, na
আমি জরুরি ব্যালেন্স নিতে পারছি না কেন?, negative, low, na, na
জানানোর জন্য ধন্যবাদ, positive, na, na, na
আমি বোর্ড চ্যালেঞ্জ করে এ+ পেয়েছি কিন্তু আবেদন গ্রহণ করছে না এখন কি করবো, negative, moderate, na, low
২১ টাকা দিয়ে ১ জিবি অফারটা এখন কত টাকা লাগে প্লিজ জানাবেন, neutral, na, na, na
সিসি কোড জামালপুর কতো?, neutral, na, na, na
আমি টেলিটকের 'আগামী' প্যাকেজের জন্য আবেদন করবো কিভাবে?, neutral, low, na, na
আমার এখানে ইন্টারনেট নেটওয়ার্ক একদম থাকেনা। পারলে এটা একটু ঠিক করুন, negative, na, slow, na
আমি আগামী টেলিটক সিমটি কিভাবে নিতে পারবো?, neutral, low, na, na
আমার একটা সিম ছিল... যেটা হারিয়ে গেছে। এখন এটা কি আমি তুলতে পারব?, neutral, low, na, na
আমি সিমের জন্য মেসেজ পাঠাই আমার শুধু আইডি নম্বর এসেছে ওটিপি আসে নি আমি কি সিম নিতে পারবো?, negative, low, na, na
টেলিটকে অফার চেক করে কিভাবে?, neutral, moderate, na, na
টেলিটক আগামী সিম কিভাবে পাওয়া যায়?, neutral, low, na, na
"যে বাজে নেট গতি, ইন্টারনেট ব্যবহারই করতে পারি না", negative, na, slow, na
আগামী সিম তোলার ক্ষেত্রে অনলাইন প্রশংসাপত্রটা দিয়ে তোলা যাবে কিনা? ২০২০ এর যারা পরীক্ষার্থী তাদের তো বোর্ড কর্তৃক প্রশংসাপত্র আসে নাই।, neutral, low, na, na
কল দিলে বলছে আউটগোয়িং কল বন্ধ। কাস্টমার সেন্টারে কি ভাবে কল করবো। শতবর্ষ সিম..., negative, low, slow, low
টেলিটক সিমের নাম্বার দেখবো কি কোড দিয়ে, neutral, moderate, na, na
সিরাজগঞ্জের কোথায় আপনাদের কাস্টমার কেয়ার রয়েছে?, neutral, na, na, na
টেলিটক লালমনিরহাট শোরুম কোথায়?, neutral, na, na, na
মেয়াদ কতদিন?, neutral, na, na, na
